,Title,Year,Rated,Released,Runtime,Genre,Director,Writer,Actors,Plot,Language,Country,Awards,Poster,Metascore,imdbRating,imdbVotes,imdbID,Type,DVD,BoxOffice,Production,Website,Response,Internet Movie Database,Rotten Tomatoes,Metacritic,totalSeasons,Season,Episode,seriesID
0,Beverly Hills Ninja,1997,PG-13,17 Jan 1997,88 min,"Action, Comedy",Dennis Dugan,"Mark Feldberg, Mitchell Klebanoff","Chris Farley, Nicollette Sheridan, Robin Shou, Nathaniel Parker",A man tries to rescue a woman with a little help from his half brother.,English,USA,1 nomination.,https://m.media-amazon.com/images/M/MV5BNGU1NzQ1ZmItZGVmNC00NWQ4LWEwYTYtOTc4NWE1MmY0YTk2XkEyXkFqcGdeQXVyMTQxNzMzNDI@._V1_SX300.jpg,27,5.5,"36,935",tt0118708,movie,N/A,N/A,N/A,N/A,True,5.5/10,14%,27/100,,,,
0,Metro,1997,R,17 Jan 1997,117 min,"Action, Comedy, Crime, Drama, Thriller",Thomas Carter,Randy Feldman,"Eddie Murphy, Kim Miyori, Art Evans, James Carpenter",A Hostage Negotiator teams up with a Sharpshooter to bring down a dangerous jewel thief.,English,USA,1 nomination.,https://m.media-amazon.com/images/M/MV5BYmI1ZGNiYTUtOTllNi00YWU5LThmNmItODM2N2I4OTEyYmQzXkEyXkFqcGdeQXVyMTQxNzMzNDI@._V1_SX300.jpg,N/A,5.5,"24,863",tt0119664,movie,N/A,N/A,N/A,N/A,True,5.5/10,15%,,,,,
0,The Time Machine,2002,PG-13,08 Mar 2002,96 min,"Action, Adventure, Sci-Fi",Simon Wells,"H.G. Wells (novel), David Duncan (earlier screenplay), John Logan (screenplay)","Guy Pearce, Mark Addy, Phyllida Law, Sienna Guillory","Hoping to alter the events of the past, a 19th century inventor instead travels 800,000 years into the future, where he finds humankind divided into two warring races.",English,"USA, United Arab Emirates",Nominated for 1 Oscar. Another 2 wins & 3 nominations.,https://m.media-amazon.com/images/M/MV5BMTM4YTViNGMtYTYyOS00MTViLWEyYTgtNGM0OTIwMWRmYzdhL2ltYWdlL2ltYWdlXkEyXkFqcGdeQXVyMTQxNzMzNDI@._V1_SX300.jpg,42,6.0,"116,203",tt0268695,movie,N/A,N/A,N/A,N/A,True,6.0/10,29%,42/100,,,,
0,The Strangers,2008,R,30 May 2008,86 min,"Horror, Mystery, Thriller",Bryan Bertino,Bryan Bertino,"Alex Fisher, Peter Clayton-Luce, Scott Speedman, Liv Tyler",A young couple staying in an isolated vacation home are terrorized by three unknown assailants.,English,USA,1 win & 14 nominations.,https://m.media-amazon.com/images/M/MV5BMTkxODAyODMwNV5BMl5BanBnXkFtZTcwNzk5Nzk2MQ@@._V1_SX300.jpg,47,6.2,"114,352",tt0482606,movie,N/A,N/A,N/A,N/A,True,6.2/10,48%,47/100,,,,
0,The Cement Garden,1993,Not Rated,11 Feb 1994,101 min,Drama,Andrew Birkin,"Andrew Birkin, Ian McEwan (novel)","Andrew Robertson, Charlotte Gainsbourg, Alice Coulthard, Ned Birkin","Four children try to hold things together and play a family in their isolated prefab house after the death of their parents. As they begin to deteriorate mentally, they hide their mom's festering corpse in a makeshift concrete sarcophagus.",English,"France, Germany, UK",2 wins & 3 nominations.,https://m.media-amazon.com/images/M/MV5BMTAxMTQwNTE3NTBeQTJeQWpwZ15BbWU3MDIxMzQzMzE@._V1_SX300.jpg,N/A,7.1,"4,228",tt0106535,movie,N/A,N/A,N/A,N/A,True,7.1/10,,,,,,
0,Dante's Peak,1997,PG-13,07 Feb 1997,108 min,"Action, Adventure, Thriller",Roger Donaldson,Leslie Bohem,"Pierce Brosnan, Linda Hamilton, Jamie Renée Smith, Jeremy Foley","A vulcanologist arrives at a countryside town recently named the second most desirable place to live in America, and discovers that the long dormant volcano, Dante's Peak, may wake up at any moment.",English,USA,4 wins & 1 nomination.,https://m.media-amazon.com/images/M/MV5BMTA1MWM3Y2MtM2YyMS00ZGI1LTgwMGQtMzczYjA5ZThmZTQ1XkEyXkFqcGdeQXVyNDk3NzU2MTQ@._V1_SX300.jpg,43,5.9,"78,414",tt0118928,movie,N/A,N/A,N/A,N/A,True,5.9/10,26%,43/100,,,,
0,Meet Wally Sparks,1997,R,31 Jan 1997,105 min,Comedy,Peter Baldwin,"Harry Basil (story), Rodney Dangerfield (screenplay), Harry Basil (screenplay)","Rodney Dangerfield, Debi Mazar, David Ogden Stiers, Burt Reynolds","Wally Sparks is a tabloid television show reporter, who's trying to boost ratings on his show. He goes to the Governor's mansion to uncover a sex scandal.",English,"Japan, USA",N/A,https://m.media-amazon.com/images/M/MV5BYzQxNzhkNzQtNjRiYy00ZGRhLWE0NDEtYzY4ZWEyN2Q1M2ViXkEyXkFqcGdeQXVyNzc5MjA3OA@@._V1_SX300.jpg,N/A,5.3,"2,982",tt0119644,movie,20 Sep 1999,N/A,Trimark,N/A,True,5.3/10,13%,,,,,
0,Amos & Andrew,1993,PG-13,05 Mar 1993,96 min,"Comedy, Crime",E. Max Frye,E. Max Frye,"Samuel L. Jackson, Michael Lerner, Margaret Colin, Nicolas Cage","A Pulitzer prize writer buys a cabin. The neighbors get suspicious when a stranger ""breaks in"". They see a black man and call the police, who start shooting at him. The sheriff tries a cover-up involving a white petty crook. Bad idea.","English, Spanish",USA,N/A,https://m.media-amazon.com/images/M/MV5BNTZhNzhmNWEtNjllOC00YjE1LWE1ZDUtYTk4MzUwZTk0Y2IyXkEyXkFqcGdeQXVyNzc5MjA3OA@@._V1_SX300.jpg,N/A,5.7,"8,193",tt0106266,movie,N/A,N/A,N/A,N/A,True,5.7/10,20%,,,,,
0,Benny & Joon,1993,PG,23 Apr 1993,98 min,"Comedy, Drama, Romance",Jeremiah S. Chechik,"Barry Berman (story), Lesley McNeil (story), Barry Berman (screenplay)","Johnny Depp, Mary Stuart Masterson, Aidan Quinn, Julianne Moore",A mentally ill young woman finds her love in an eccentric man who models himself after Buster Keaton.,English,USA,Nominated for 1 Golden Globe. Another 3 nominations.,https://m.media-amazon.com/images/M/MV5BMTUwMzkyNjIzMl5BMl5BanBnXkFtZTcwMDMyNDcyNA@@._V1_SX300.jpg,57,7.2,"52,944",tt0106387,movie,N/A,N/A,N/A,N/A,True,7.2/10,71%,57/100,,,,
0,Prefontaine,1997,PG-13,24 Jan 1997,106 min,"Biography, Drama, Romance, Sport",Steve James,"Steve James, Eugene Corr","Jared Leto, R. Lee Ermey, Ed O'Neill, Breckin Meyer","Based on the life of Olympic hopeful Steve Prefontaine, a long distance runner who lived in Oregon and died young.",English,USA,N/A,https://m.media-amazon.com/images/M/MV5BMTk2MzE0NjQ0Nl5BMl5BanBnXkFtZTcwMzUxMjkxMQ@@._V1_SX300.jpg,56,6.8,"6,732",tt0119937,movie,N/A,N/A,N/A,N/A,True,6.8/10,56%,56/100,,,,
0,Guantanamera,1995,N/A,04 Jul 1997,105 min,"Comedy, Drama","Tomás Gutiérrez Alea, Juan Carlos Tabío","Eliseo Alberto, Tomás Gutiérrez Alea, Juan Carlos Tabío","Carlos Cruz, Mirta Ibarra, Jorge Perugorría, Raúl Eguren",It is a satire about life in Cuba. The members of a funeral procession and some truckdrivers who have to take the same route begin to talk about god and the world ending up in discovering ...,Spanish,"Cuba, Spain, Germany",7 wins & 1 nomination.,https://m.media-amazon.com/images/M/MV5BMTczMzk1NzE4OV5BMl5BanBnXkFtZTcwNDA0MzMzMQ@@._V1_SX300.jpg,N/A,6.9,"1,326",tt0109949,movie,10 Oct 2000,N/A,Ciné 360 Inc.,N/A,True,6.9/10,80%,,,,,
0,McHale's Navy,1997,PG,18 Apr 1997,108 min,"Action, Comedy",Bryan Spicer,"Peter Crabbe (story), Andy Rose (story), Peter Crabbe (screenplay)","Tom Arnold, Dean Stockwell, Debra Messing, David Alan Grier","Retired Lieutenant Commander Quinton McHale spends his days puttering around the Caribbean in the old PT-73 selling homebrew, ice cream, and swimsuit calendars. He's brought out of ...",English,USA,2 wins & 2 nominations.,https://m.media-amazon.com/images/M/MV5BMmU2NjcwYmMtZmZhYy00NjQ0LTkyZTktM2EwMWU2M2Y3ZmI4XkEyXkFqcGdeQXVyMTQxNzMzNDI@._V1_SX300.jpg,18,4.6,"6,141",tt0119640,movie,N/A,N/A,N/A,N/A,True,4.6/10,3%,18/100,,,,
0,Kolya,1996,PG-13,24 Jan 1997,105 min,"Comedy, Drama, Music",Jan Sverák,"Pavel Taussig (story), Zdenek Sverák (screenplay)","Zdenek Sverák, Andrey Khalimon, Libuse Safránková, Ondrej Vetchý","Franta Louka is a concert cellist in Soviet-occupied Czechoslovakia, a confirmed bachelor and a lady's man. Having lost his place in the state orchestra, he must make ends meet by playing ...","Czech, Russian, Slovak","Czech Republic, UK, France",Won 1 Oscar. Another 20 wins & 13 nominations.,https://m.media-amazon.com/images/M/MV5BYWU4ZTVkZjgtYTlkNi00YTY2LWExOWUtZDI5MDFhNjc3NDE1XkEyXkFqcGdeQXVyMjIxMzMyMQ@@._V1_SX300.jpg,N/A,7.8,"14,003",tt0116790,movie,02 Jul 2002,N/A,Miramax,N/A,True,7.8/10,96%,,,,,
0,Gridlock'd,1997,R,29 Jan 1997,91 min,"Comedy, Crime, Drama",Vondie Curtis-Hall,Vondie Curtis-Hall,"Tim Roth, Tupac Shakur, Thandie Newton, Charles Fleischer","Two friends try to kick their drug addiction after a friend dies from an overdose, when they try to enroll in a detox program, things quickly go wrong.",English,USA,2 wins & 1 nomination.,https://m.media-amazon.com/images/M/MV5BNWFlYTY1YWUtOWY1Yy00ODgwLTk0YzQtYTdjMDBlOTcwMGZhXkEyXkFqcGdeQXVyMTQxNzMzNDI@._V1_SX300.jpg,N/A,6.9,"14,155",tt0119225,movie,N/A,N/A,N/A,N/A,True,6.9/10,88%,,,,,
0,Waiting for Guffman,1996,R,31 Jan 1997,84 min,Comedy,Christopher Guest,"Christopher Guest, Eugene Levy","Deborah Theaker, Michael Hitchcock, Scott Williamson, Larry Miller",An aspiring director and the marginally talented amateur cast of a hokey small-town Missouri musical production go overboard when they learn that someone from Broadway will be in attendance.,English,USA,2 wins & 3 nominations.,https://m.media-amazon.com/images/M/MV5BYWY4OGVjOTctYTViZC00MWQzLWIyNjYtM2JmOWIzZGQwNWYyXkEyXkFqcGdeQXVyMTQxNzMzNDI@._V1_SX300.jpg,71,7.5,"25,594",tt0118111,movie,N/A,N/A,N/A,N/A,True,7.5/10,91%,71/100,,,,
0,Prisoner of the Mountains,1996,R,31 Jan 1997,99 min,"Drama, War",Sergei Bodrov,"Arif Aliev, Sergei Bodrov, Boris Giller","Oleg Menshikov, Sergey Bodrov, Jemal Sikharulidze, Susanna Mekhraliyeva","Two Russian soldiers, one battle-seasoned and the other barely into his boots and uniform, are taken prisoner by an anxious Islamic father from a remote village hoping to trade them for his captured son.","Russian, Turkish, Georgian, Chechen","Russia, Kazakhstan",Nominated for 1 Oscar. Another 14 wins & 4 nominations.,https://m.media-amazon.com/images/M/MV5BZGZjMTc4ZDgtYTRkZS00NzY2LTlhMzMtODJmZGJhOTI4NjFlXkEyXkFqcGdeQXVyNjMwMjk0MTQ@._V1_SX300.jpg,N/A,7.5,"4,013",tt0116754,movie,N/A,N/A,N/A,N/A,True,7.5/10,88%,,,,,
0,The Beautician and the Beast,1997,PG,07 Feb 1997,105 min,"Comedy, Romance",Ken Kwapis,Todd Graff,"Fran Drescher, Timothy Dalton, Ian McNeice, Patrick Malahide","A New York City cosmetologist, mistakenly thought to be a science teacher, is offered a job to teach the children of an Eastern European dictator.",English,USA,1 nomination.,https://m.media-amazon.com/images/M/MV5BOGViZjFhM2MtOGNmZC00MWQyLWJiM2MtODdkMDdlYmFmMjYzXkEyXkFqcGdeQXVyMTkzODUwNzk@._V1_SX300.jpg,N/A,5.4,"8,271",tt0118691,movie,N/A,N/A,N/A,N/A,True,5.4/10,18%,,,,,
0,SubUrbia,1996,R,03 Jul 1997,121 min,"Comedy, Drama",Richard Linklater,"Eric Bogosian (play), Eric Bogosian (screenplay)","Jayce Bartok, Amie Carey, Nicky Katt, Ajay Naidu",A group of suburban teenagers try to support each other through the difficult task of becoming adults.,English,USA,1 nomination.,https://m.media-amazon.com/images/M/MV5BZjMxODA3MWItNzVlZS00MzQ0LTljZjYtMzhhNmNjMWFjYTY0XkEyXkFqcGdeQXVyMTQxNzMzNDI@._V1_SX300.jpg,62,6.8,"8,506",tt0120238,movie,N/A,N/A,WARNER BROTHERS PICTURES,N/A,True,6.8/10,65%,62/100,,,,
0,Hotel de Love,1996,R,07 Feb 1997,96 min,"Comedy, Drama, Romance",Craig Rosenberg,Craig Rosenberg,"Aden Young, Saffron Burrows, Simon Bossell, Pippa Grandison",Twin brothers meet a childhood sweetheart at a tacky hotel and rediscover their love as they renew their competition for her affection.,"English, French",Australia,N/A,https://m.media-amazon.com/images/M/MV5BMTI2OTA0MzE0NF5BMl5BanBnXkFtZTcwMjA2NjEyMQ@@._V1_SX300.jpg,47,6.3,602,tt0116565,movie,17 Jun 1997,N/A,Warner Elektra Atlantic,N/A,True,6.3/10,22%,47/100,,,,
0,The Pest,1997,PG-13,07 Feb 1997,84 min,Comedy,Paul Miller,"David Bar Katz (story), John Leguizamo (story), David Bar Katz (screenplay)","John Leguizamo, Jeffrey Jones, Freddy Rodríguez, Pat Skipper","A Miami con man agrees to be the human target for a Neo-Nazi manhunter, in order to collect $50,000 if he survives.",English,USA,1 nomination.,https://m.media-amazon.com/images/M/MV5BNjZhNzg2OWQtMDBkYi00MTY5LTkxMDItMDc2MzVmNGU1MzM5XkEyXkFqcGdeQXVyNjMwMjk0MTQ@._V1_SX300.jpg,N/A,5.0,"7,718",tt0119887,movie,N/A,N/A,N/A,N/A,True,5.0/10,8%,,,,,
0,Fools Rush In,1997,PG-13,14 Feb 1997,109 min,"Comedy, Drama, Romance",Andy Tennant,"Joan Taylor (story), Katherine Reback (story), Katherine Reback (screenplay)","Matthew Perry, Salma Hayek, Jon Tenney, Carlos Gómez","After a one night stand with Alex, Isabel realizes that she is pregnant and they decide to get married. However, along with the marriage comes compromise of one's own cultural traditions.","English, Spanish",USA,3 nominations.,https://m.media-amazon.com/images/M/MV5BM2Q3MzA3YmYtNzUzNS00NDhhLTkyZmYtMDU2YmE1ODY5MjdmXkEyXkFqcGdeQXVyNjQ2MjQ5NzM@._V1_SX300.jpg,37,6.0,"31,583",tt0119141,movie,N/A,N/A,N/A,N/A,True,6.0/10,32%,37/100,,,,
0,Touch,1997,R,14 Feb 1997,96 min,"Comedy, Drama, Romance",Paul Schrader,"Elmore Leonard (novel), Paul Schrader (screenplay)","LL Cool J, Gina Gershon, Conchata Ferrell, John Doe","When Juvenal, a presumed miracle worker, appears on the scene Bill Hill attempts to exploit him but his plans go astray with the untimely intervention of August Murray and the developing ...",English,USA,3 nominations.,https://m.media-amazon.com/images/M/MV5BMTIwMzE0OTU3Nl5BMl5BanBnXkFtZTcwNTI1OTEyMQ@@._V1_SX300.jpg,56,5.6,"2,165",tt0120357,movie,N/A,N/A,N/A,N/A,True,5.6/10,33%,56/100,,,,
0,Absolute Power,1997,R,14 Feb 1997,121 min,"Action, Crime, Drama, Thriller",Clint Eastwood,"David Baldacci (book), William Goldman (screenplay)","Clint Eastwood, Gene Hackman, Ed Harris, Laura Linney",Career thief Luther Whitney (Clint Eastwood) witnesses a horrific crime involving U.S. President Alan Richmond (Gene Hackman).,"English, Spanish",USA,1 nomination.,https://m.media-amazon.com/images/M/MV5BNDFlNTZmOGYtYmE0ZC00OTE4LWI5YzctNmZmZDU3M2ZiMmI4XkEyXkFqcGdeQXVyNDk3NzU2MTQ@._V1_SX300.jpg,52,6.7,"48,550",tt0118548,movie,N/A,N/A,N/A,N/A,True,6.7/10,48%,52/100,,,,
0,That Darn Cat,1997,PG,14 Feb 1997,89 min,"Action, Comedy, Crime, Family, Mystery",Bob Spiers,"Gordon Gordon (novel), Mildred Gordon (novel), Gordon Gordon, Mildred Gordon, Bill Walsh, Scott Alexander (screenplay), Larry Karaszewski (screenplay)","Christina Ricci, Doug E. Doug, Dean Jones, George Dzundza","A maid is kidnapped and scratches a message onto D.C. the cat's collar and when his owner Patti discovers this, she plays amateur detective with the help of D.C. to try to find the culprits.",English,USA,2 nominations.,https://m.media-amazon.com/images/M/MV5BNjAxMjI0MTEtZDI4Yi00OWIzLTkxY2QtZDZhYTZkOGE4N2NiL2ltYWdlL2ltYWdlXkEyXkFqcGdeQXVyMTQxNzMzNDI@._V1_SX300.jpg,36,4.7,"3,952",tt0120317,movie,08 Mar 2005,N/A,Disney,N/A,True,4.7/10,13%,36/100,,,,
0,Vegas Vacation,1997,PG,14 Feb 1997,93 min,Comedy,Stephen Kessler,"Elisa Bell (story), Bob Ducsay (story), Elisa Bell (screenplay)","Chevy Chase, Beverly D'Angelo, Randy Quaid, Ethan Embry","In the fourth outing for the vacation franchise, the Griswolds have to survive Vegas fever when they go to Las Vegas for a fun family vacation.",English,USA,1 nomination.,https://m.media-amazon.com/images/M/MV5BZTIwMWEwZmQtMjI1ZS00NDdmLTgwMGItNmFiOTk1ZWQ5NGZiXkEyXkFqcGdeQXVyMTQxNzMzNDI@._V1_SX300.jpg,20,6.0,"43,113",tt0120434,movie,N/A,N/A,N/A,N/A,True,6.0/10,13%,20/100,,,,
0,That Old Feeling,1997,PG-13,04 Apr 1997,105 min,"Comedy, Romance",Carl Reiner,Leslie Dixon,"Bette Midler, Dennis Farina, Paula Marshall, Gail O'Grady",A bride's divorced parents find their old feelings for each other during the wedding reception and over the course of the next few days upsetting the newlywed's honeymoon.,English,USA,2 nominations.,https://m.media-amazon.com/images/M/MV5BNGUyY2NlOGItZDRjOC00NGI3LWE1NzUtYWNmMGFhNDc5OGU4XkEyXkFqcGdeQXVyNDk3NzU2MTQ@._V1_SX300.jpg,N/A,6.2,"3,457",tt0120318,movie,N/A,N/A,N/A,N/A,True,6.2/10,43%,,,,,
0,Lost Highway,1997,R,15 Jan 1997,134 min,"Mystery, Thriller",David Lynch,"David Lynch, Barry Gifford","Bill Pullman, Patricia Arquette, John Roselius, Louis Eppolito","After a bizarre encounter at a party, a jazz saxophonist is framed for the murder of his wife and sent to prison, where he inexplicably morphs into a young mechanic and begins leading a new life.",English,"France, USA",4 wins & 5 nominations.,https://m.media-amazon.com/images/M/MV5BYWUxOWY4NDctMDFmMS00ZTQwLWExMGEtODg0ZWNhOTE5NzZmXkEyXkFqcGdeQXVyMTQxNzMzNDI@._V1_SX300.jpg,52,7.6,"125,953",tt0116922,movie,N/A,N/A,N/A,N/A,True,7.6/10,60%,52/100,,,,
0,Rosewood,1997,R,21 Feb 1997,140 min,"Action, Drama, History",John Singleton,Gregory Poirier,"Jon Voight, Ving Rhames, Don Cheadle, Bruce McGill",A dramatization of a 1923 horrific racist lynch mob attack on an African-American community.,English,USA,3 wins & 10 nominations.,https://m.media-amazon.com/images/M/MV5BYWNmZGM3NjUtOTgzYi00YjVmLTk4NGYtNGQ1Y2MwZjBkN2I3XkEyXkFqcGdeQXVyMTQxNzMzNDI@._V1_SX300.jpg,71,7.2,"7,124",tt0120036,movie,N/A,N/A,N/A,N/A,True,7.2/10,86%,71/100,,,,
0,Donnie Brasco,1997,R,28 Feb 1997,127 min,"Biography, Crime, Drama",Mike Newell,"Joseph D. Pistone (book), Richard Woodley (book), Paul Attanasio (screenplay)","Al Pacino, Johnny Depp, Michael Madsen, Bruno Kirby","An FBI undercover agent infiltrates the mob and finds himself identifying more with the mafia life, at the expense of his regular one.","English, Italian, Japanese",USA,Nominated for 1 Oscar. Another 2 wins & 15 nominations.,https://m.media-amazon.com/images/M/MV5BYzMzMDZkYWEtODIzNS00YjI3LTkxNTktOWEyZGM3ZWI2MWM4XkEyXkFqcGdeQXVyNzkwMjQ5NzM@._V1_SX300.jpg,76,7.7,"266,998",tt0119008,movie,N/A,N/A,N/A,N/A,True,7.7/10,88%,76/100,,,,
0,Booty Call,1997,R,26 Feb 1997,79 min,"Comedy, Romance",Jeff Pollack,"Takashi Bufford, J. Stanford Parker","Jamie Foxx, Tommy Davidson, Amy Monique Waddell, Wiley Moore",Two friends who have gone too long without sex set out to get some.,English,USA,N/A,https://m.media-amazon.com/images/M/MV5BMTk2NTgwODY2M15BMl5BanBnXkFtZTYwNDk4OTE5._V1_SX300.jpg,54,5.4,"8,074",tt0118750,movie,N/A,N/A,N/A,N/A,True,5.4/10,25%,54/100,,,,
0,Boys Life 2,1997,N/A,07 Mar 1997,74 min,Drama,"Mark Christopher, Tom DeCerchio, Tom Donaghy, Nickolas Perry","Mark Christopher (segment), Tom DeCerchio (segment), Tom Donaghy (segment), Nickolas Perry (segment)","Michael Saucedo, Justin Urich, Travis Sher, Milo Ventimiglia","Compilation of four short films about homoerotic situations involving young men. Tom DeCerchio directed ""Nunzio's Second Cousin"", telling the story of a gay cop who forces a gay-basher to ...",English,USA,N/A,https://m.media-amazon.com/images/M/MV5BMTYxMTg5NDgwMV5BMl5BanBnXkFtZTcwNzA4NzgxMQ@@._V1_SX300.jpg,N/A,6.6,428,tt0118762,movie,N/A,N/A,N/A,N/A,True,6.6/10,80%,,,,,
0,City of Industry,1997,R,14 Mar 1997,97 min,"Crime, Drama, Thriller",John Irvin,Ken Solarz,"Harvey Keitel, Stephen Dorff, Timothy Hutton, Famke Janssen","A retired thief swears revenge on the lunatic who murdered his brother and partner, while going on the run with the loot they stole.",English,USA,1 nomination.,https://m.media-amazon.com/images/M/MV5BZTlkYWUxMGItNjdjZi00MjBkLTg2ZWMtMGJmOWNkMDllM2I2XkEyXkFqcGdeQXVyMTMxMTY0OTQ@._V1_SX300.jpg,N/A,6.1,"5,509",tt0118859,movie,06 Feb 2001,N/A,Orion Home Video,N/A,True,6.1/10,43%,,,,,
0,Children of Men,2006,R,05 Jan 2007,109 min,"Drama, Sci-Fi, Thriller",Alfonso Cuarón,"Alfonso Cuarón (screenplay), Timothy J. Sexton (screenplay), David Arata (screenplay), Mark Fergus (screenplay), Hawk Ostby (screenplay), P.D. James (novel)","Juan Gabriel Yacuzzi, Mishal Husain, Rob Curling, Jon Chevalier","In 2027, in a chaotic world in which women have become somehow infertile, a former activist agrees to help transport a miraculously pregnant woman to a sanctuary at sea.","English, German, Italian, Romanian, Spanish, Arabic, Georgian, Russian, Serbian","USA, UK, Japan",Nominated for 3 Oscars. Another 49 wins & 79 nominations.,https://m.media-amazon.com/images/M/MV5BMTQ5NTI2NTI4NF5BMl5BanBnXkFtZTcwNjk2NDA2OQ@@._V1_SX300.jpg,84,7.9,"449,909",tt0206634,movie,N/A,N/A,N/A,N/A,True,7.9/10,92%,84/100,,,,
0,Jungle 2 Jungle,1997,PG,07 Mar 1997,105 min,"Comedy, Family",John Pasquin,"Hervé Palud (earlier screenplay Un indien dans la ville), Thierry Lhermitte (earlier screenplay Un indien dans la ville), Jean-Marie Pallardy (earlier screenplay Un indien dans la ville), Philippe Bruneau (earlier screenplay Un indien dans la ville), Bruce A. Evans (screenplay), Raynold Gideon (screenplay)","Tim Allen, Martin Short, JoBeth Williams, Lolita Davidovich","A man learns he has a thirteen-year-old son who was raised in the jungle and brings the boy to New York City, turning his life upside down in the process.",English,"USA, France",3 nominations.,https://m.media-amazon.com/images/M/MV5BM2Q4MjNjNmYtOGYyZS00OGUzLWI4OTQtZjI0NmFiZTUyZDAwXkEyXkFqcGdeQXVyNTUyMzE4Mzg@._V1_SX300.jpg,42,5.2,"22,239",tt0119432,movie,N/A,N/A,N/A,N/A,True,5.2/10,19%,42/100,,,,
0,Kama Sutra: A Tale of Love,1996,R,28 Feb 1997,114 min,"Crime, Drama, History, Romance",Mira Nair,"Helena Kriel, Mira Nair, Wajida Tabassum (story ""Hand Me Downs"")","Indira Varma, Sarita Choudhury, Ramon Tikaram, Naveen Andrews",Two female friends become sexual rivals at maturity.,"English, Italian","USA, India, UK, Japan, Germany",1 win & 1 nomination.,https://m.media-amazon.com/images/M/MV5BNDY5Njc3OWMtYjQwNS00YzM0LTgxZTItNjVjZDk3MWQxYjEzL2ltYWdlL2ltYWdlXkEyXkFqcGdeQXVyNjQ2MjQ5NzM@._V1_SX300.jpg,N/A,6.0,"9,598",tt0116743,movie,N/A,N/A,N/A,N/A,True,6.0/10,40%,,,,,
0,Private Parts,1997,R,07 Mar 1997,109 min,"Biography, Comedy, Drama",Betty Thomas,"Howard Stern (book), Len Blum (screenplay), Michael Kalesniko (screenplay)","Howard Stern, Robin Quivers, Mary McCormack, Fred Norris","The autobiographical story of Howard Stern, the radio rebel who is now also a TV personality, an author and a movie star.",English,USA,2 wins & 3 nominations.,https://m.media-amazon.com/images/M/MV5BNDhjZjAxNzgtNzU3NS00OWQxLWI2ODItMjk0NmRjMTU5MDhjXkEyXkFqcGdeQXVyMTQxNzMzNDI@._V1_SX300.jpg,67,6.9,"33,014",tt0119951,movie,N/A,N/A,N/A,N/A,True,6.9/10,,67/100,,,,
0,Love Jones,1997,R,14 Mar 1997,104 min,"Drama, Romance",Theodore Witcher,Theodore Witcher,"Larenz Tate, Nia Long, Isaiah Washington, Lisa Nicole Carson","Darius Lovehall is a young black poet in Chicago who starts dating Nina Mosley, a beautiful and talented photographer. While trying to figure out if they've got a ""love thing"" or are just ""...",English,USA,2 wins & 7 nominations.,https://m.media-amazon.com/images/M/MV5BOGEzMmFlMmYtNDU2NS00YWEzLTg5ZDktZGI4MjAxNTVkNjc1XkEyXkFqcGdeQXVyNjMwMjk0MTQ@._V1_SX300.jpg,N/A,7.5,"3,722",tt0119572,movie,N/A,N/A,N/A,N/A,True,7.5/10,73%,,,,,
0,The Saint,1997,PG-13,04 Apr 1997,116 min,"Action, Adventure, Romance, Sci-Fi, Thriller",Phillip Noyce,"Leslie Charteris (character), Jonathan Hensleigh (story), Jonathan Hensleigh (screenplay), Wesley Strick (screenplay)","Val Kilmer, Elisabeth Shue, Rade Serbedzija, Valeriy Nikolaev","Simon Templar (The Saint), is a thief for hire, whose latest job to steal the secret process for cold fusion puts him at odds with a traitor bent on toppling the Russian government, as well as the woman who holds its secret.","English, Russian",USA,1 win & 2 nominations.,https://m.media-amazon.com/images/M/MV5BNmM3MjI2YjUtYjk1MS00M2VjLWI4MmUtM2UyYWQyNTVlZGE5XkEyXkFqcGdeQXVyNjc1NTYyMjg@._V1_SX300.jpg,50,6.2,"60,603",tt0120053,movie,N/A,N/A,N/A,N/A,True,6.2/10,30%,50/100,,,,
0,Smilla's Sense of Snow,1997,R,28 Feb 1997,121 min,"Crime, Drama, Mystery, Sci-Fi, Thriller",Bille August,"Peter Høeg (novel), Ann Biderman (screenplay)","Jens Jørgen Fleischer, Julia Ormond, Agga Olsen, Patrick Field","A 6 y.o. Inuit boy runs off a snowy roof in Copenhagen and dies. Smilla, a half Inuit who lives in the building and knows the boy, looks into it. What makes an acrophobic boy run up on the roof? The clues take her to Greenland.","English, Inuktitut","Denmark, Germany, Sweden",1 nomination.,https://m.media-amazon.com/images/M/MV5BM2FlOGNmNjItMGYwMC00NjMxLWJiZGUtZTI4MGZmYTllM2JkXkEyXkFqcGdeQXVyNjU0NTI0Nw@@._V1_SX300.jpg,45,6.4,"13,414",tt0120152,movie,N/A,N/A,N/A,N/A,True,6.4/10,52%,45/100,,,,
0,Van Helsing,2004,PG-13,07 May 2004,131 min,"Action, Adventure, Fantasy",Stephen Sommers,Stephen Sommers,"Hugh Jackman, Kate Beckinsale, Richard Roxburgh, David Wenham",The notorious monster hunter is sent to Transylvania to stop Count Dracula who is using Dr. Frankenstein's research and a werewolf for some sinister purpose.,"English, Latin","USA, Czech Republic, Romania",3 wins & 21 nominations.,https://m.media-amazon.com/images/M/MV5BODRmY2NhNDItOWViNi00OTIyLTk3YjYtYzY0YTFlMDg1YzQ0L2ltYWdlL2ltYWdlXkEyXkFqcGdeQXVyMTQxNzMzNDI@._V1_SX300.jpg,35,6.1,"238,785",tt0338526,movie,N/A,N/A,N/A,N/A,True,6.1/10,,35/100,,,,
0,Crash,2004,R,06 May 2005,112 min,"Crime, Drama, Thriller",Paul Haggis,"Paul Haggis (story), Paul Haggis (screenplay), Bobby Moresco (screenplay)","Karina Arroyave, Dato Bakhtadze, Sandra Bullock, Don Cheadle","Los Angeles citizens with vastly separate lives collide in interweaving stories of race, loss and redemption.","English, Persian, Spanish, Mandarin, Korean","USA, Germany",Won 3 Oscars. Another 64 wins & 111 nominations.,https://m.media-amazon.com/images/M/MV5BOTk1OTA1MjIyNV5BMl5BanBnXkFtZTcwODQxMTkyMQ@@._V1_SX300.jpg,66,7.8,"411,941",tt0375679,movie,N/A,N/A,N/A,N/A,True,7.8/10,74%,66/100,,,,
0,The Daytrippers,1996,R,05 Mar 1997,87 min,"Comedy, Drama",Greg Mottola,Greg Mottola,"Stanley Tucci, Hope Davis, Pat McNamara, Anne Meara","When a happily-married woman discovers a love letter written by her husband to an unknown person, she enlists her dysfunctional family to discover the truth.",English,"Canada, USA",7 wins & 3 nominations.,https://m.media-amazon.com/images/M/MV5BYjI4MmJmNzMtMTg5ZC00ZjAwLWExYzUtOTM2OGZiMTI3MjQ0XkEyXkFqcGdeQXVyMTQxNzMzNDI@._V1_SX300.jpg,73,6.8,"4,132",tt0116041,movie,N/A,N/A,N/A,N/A,True,6.8/10,73%,73/100,,,,
