,Title,Year,Rated,Released,Runtime,Genre,Director,Writer,Actors,Plot,Language,Country,Awards,Poster,Metascore,imdbRating,imdbVotes,imdbID,Type,DVD,BoxOffice,Production,Website,Response,Internet Movie Database,Rotten Tomatoes,Metacritic,totalSeasons,Season,Episode,seriesID
0,Mr. Magoo,1997,PG,25 Dec 1997,87 min,"Adventure, Comedy, Family",Stanley Tong,"Pat Proft, Tom Sherohman","Leslie Nielsen, Kelly Lynch, Matt Keeslar, Nick Chinlund",The myopic millionaire defeats jewel smugglers in his usual bumbling manner.,English,USA,2 nominations.,https://m.media-amazon.com/images/M/MV5BODFiOWY2OTctMzBlNi00MjhhLTg4MWQtMTI5YTUzZTI2N2E1XkEyXkFqcGdeQXVyNTUyMzE4Mzg@._V1_SX300.jpg,18,4.0,"13,939",tt0119718,movie,N/A,N/A,N/A,N/A,True,4.0/10,7%,18/100,,,,
0,The Big Lebowski,1998,R,06 Mar 1998,117 min,"Comedy, Crime, Sport","Joel Coen, Ethan Coen","Ethan Coen, Joel Coen","Jeff Bridges, John Goodman, Julianne Moore, Steve Buscemi","Jeff ""The Dude"" Lebowski, mistaken for a millionaire of the same name, seeks restitution for his ruined rug and enlists his bowling buddies to help get it.","English, German, Hebrew, Spanish","USA, UK",5 wins & 17 nominations.,https://m.media-amazon.com/images/M/MV5BMTQ0NjUzMDMyOF5BMl5BanBnXkFtZTgwODA1OTU0MDE@._V1_SX300.jpg,71,8.1,"702,389",tt0118715,movie,N/A,N/A,N/A,N/A,True,8.1/10,82%,71/100,,,,
0,Afterglow,1997,R,20 Mar 1998,119 min,"Comedy, Drama, Romance",Alan Rudolph,Alan Rudolph,"Nick Nolte, Julie Christie, Lara Flynn Boyle, Jonny Lee Miller",A handyman with marital problems meets a housewife with the same.,"English, French",USA,Nominated for 1 Oscar. Another 8 wins & 2 nominations.,https://m.media-amazon.com/images/M/MV5BYjVlYjYzNzktYjA4Ny00ZTk2LTlmNTUtYTI5OTZkOTE2YzU4XkEyXkFqcGdeQXVyMTAwMzUyOTc@._V1_SX300.jpg,68,6.1,"3,159",tt0118566,movie,N/A,N/A,N/A,N/A,True,6.1/10,76%,68/100,,,,
0,Ma Vie en Rose,1997,R,26 Dec 1997,88 min,Drama,Alain Berliner,"Alain Berliner, Chris Vander Stappen","Michèle Laroque, Jean-Philippe Écoffey, Hélène Vincent, Georges Du Fresne",Ludovic is an innocent seven-year-old child who provokes horror in her community when she dresses in girls clothes and insists she's a girl.,French,"Belgium, France, UK",Won 1 Golden Globe. Another 12 wins & 7 nominations.,https://m.media-amazon.com/images/M/MV5BNmFkMjQ5M2ItY2ZiNi00Njg1LTkwMWItMTI2MGIzY2VhMDE5XkEyXkFqcGdeQXVyODU5MDg5OTY@._V1_SX300.jpg,N/A,7.6,"8,152",tt0119590,movie,N/A,N/A,N/A,N/A,True,7.6/10,91%,,,,,
0,Great Expectations,1998,R,30 Jan 1998,111 min,"Drama, Romance",Alfonso Cuarón,"Charles Dickens (novel), Mitch Glazer (screenplay)","Ethan Hawke, Gwyneth Paltrow, Hank Azaria, Chris Cooper",Modernization of Charles Dickens classic story finds the hapless Finn as a painter in New York City pursuing his unrequited and haughty childhood love.,"English, French, Portuguese",USA,1 win & 3 nominations.,https://m.media-amazon.com/images/M/MV5BMDFiODQ3ZmEtZDQwYS00ZmQ4LWIxYzItYzM2YmVhNDRmZmFiXkEyXkFqcGdeQXVyNTk5Nzg1NjQ@._V1_SX300.jpg,55,6.9,"49,772",tt0119223,movie,N/A,N/A,N/A,N/A,True,6.9/10,37%,55/100,,,,
0,3 Ninjas: High Noon at Mega Mountain,1998,PG,18 Jun 1998,93 min,"Action, Adventure, Comedy, Family",Sean McNamara,"Sean McNamara, Jeff Phillips","Hulk Hogan, Loni Anderson, Jim Varney, Mathew Botuchis","Three young boys, Rocky, Colt and Tum Tum together with their neighbor girl, computer whiz Amanda are visiting Mega Mountain amusement park when it is invaded by an army of ninjas led by ...",English,USA,2 nominations.,https://m.media-amazon.com/images/M/MV5BY2IzOTc2OWEtYTEwYy00ZTk5LWIxZWYtNDc3ZjM4MTZkODk4XkEyXkFqcGdeQXVyMTQxNzMzNDI@._V1_SX300.jpg,44,2.9,"10,291",tt0118539,movie,N/A,N/A,N/A,N/A,True,2.9/10,0%,44/100,,,,
0,Men of Means,1998,N/A,25 May 1999,80 min,"Action, Drama",George Mendeluk,Shane Perez,"Kaela Dobkin, Raymond Serra, Austin Pendleton, Tony Cucci","In a world where two men in close proximity will eventually draw guns, Rico ""BULLET"" Burke finds himself at a crossroads. Having long ago ruined his brilliant collegiate football career ...",English,Canada,N/A,https://m.media-amazon.com/images/M/MV5BODlkM2RlZjgtY2Q2Yi00MzA0LWIyZWYtMDYxMTdmODQ0ZWRkXkEyXkFqcGdeQXVyMjAyOTg5Njg@._V1_SX300.jpg,N/A,6.1,133,tt0119655,movie,N/A,N/A,N/A,N/A,True,6.1/10,,,,,,
0,Caught Up,1998,R,27 Feb 1998,97 min,"Crime, Drama, Thriller",Darin Scott,Darin Scott,"Bokeem Woodbine, Damon Saleem, Cynda Williams, Jeffrey Combs","She caught his eye. He was caught off guard. Now Daryl Allen is caught in the line of fire. After six years behind bars, a reformed street hood(Bokeem Woodbine) puts down his gun and ...",English,USA,N/A,https://m.media-amazon.com/images/M/MV5BNTk1MjIzMzExNl5BMl5BanBnXkFtZTcwMjc0OTgyMQ@@._V1_SX300.jpg,N/A,5.4,823,tt0119988,movie,N/A,N/A,N/A,N/A,True,5.4/10,0%,,,,,
0,Arguing the World,1998,NOT RATED,07 Jan 1998,106 min,Documentary,Joseph Dorman,Joseph Dorman,"Daniel Bell, Nathan Glazer, Irving Howe, Irving Kristol","A true story of four Jewish intellectuals born in New York and educated at City College during the 1930s, and their divergent paths over the next six decades.",English,USA,N/A,https://m.media-amazon.com/images/M/MV5BMTcxNTU4MTI1OF5BMl5BanBnXkFtZTcwOTI5NDA0MQ@@._V1_SX300.jpg,N/A,7.0,74,tt0129758,movie,22 Mar 2005,N/A,First Run Features,N/A,True,7.0/10,80%,,,,,
0,Firestorm,1998,R,09 Jan 1998,89 min,"Thriller, Action",Dean Semler,Chris Soth,"Howie Long, Scott Glenn, William Forsythe, Suzy Amis","Firefighter Jesse Graves has to save ornithologist Jennifer and other people caught in a forest fire, which was set up by the lawyer of convicted killer Earl Shaye, who escaped from the ...",English,USA,N/A,https://m.media-amazon.com/images/M/MV5BZTYxZjYwNGMtZWE0ZS00MjkwLTkyZjItMTJkODllN2NmNDRhXkEyXkFqcGdeQXVyMjY4NDQyNDI@._V1_SX300.jpg,N/A,4.7,"3,530",tt0120670,movie,18 Dec 2001,N/A,Twentieth Century Fox Home Entertainment,N/A,True,4.7/10,12%,,,,,
0,Senseless,1998,R,20 Feb 1998,93 min,"Comedy, Romance",Penelope Spheeris,"Greg Erb, Craig Mazin","Marlon Wayans, Brad Dourif, Esther Scott, Debra Jo Rupp",A student gets his senses enhanced by an experimental drug. But abuse is not an option.,English,USA,N/A,https://m.media-amazon.com/images/M/MV5BMjExYzk0MDctN2FkNi00NWNkLTg3ZjYtZTRmOGVlYzA5NGIyXkEyXkFqcGdeQXVyMTQ3Njg3MQ@@._V1_SX300.jpg,36,6.1,"13,675",tt0120820,movie,N/A,N/A,N/A,N/A,True,6.1/10,6%,36/100,,,,
0,Wag the Dog,1997,R,09 Jan 1998,97 min,"Comedy, Drama",Barry Levinson,"Larry Beinhart (book), Hilary Henkin (screenplay), David Mamet (screenplay)","Dustin Hoffman, Robert De Niro, Anne Heche, Woody Harrelson","Shortly before an election, a spin-doctor and a Hollywood producer join efforts to fabricate a war in order to cover up a Presidential sex scandal.","English, Albanian",USA,Nominated for 2 Oscars. Another 2 wins & 20 nominations.,https://m.media-amazon.com/images/M/MV5BMzRkZDVkMDItYjk3Mi00NDkyLThmODUtYzhkN2EwZmE2ZTljXkEyXkFqcGdeQXVyMTQxNzMzNDI@._V1_SX300.jpg,73,7.2,"76,939",tt0120885,movie,N/A,N/A,N/A,N/A,True,7.2/10,85%,73/100,,,,
0,Dark City,1998,R,27 Feb 1998,100 min,"Mystery, Sci-Fi, Thriller",Alex Proyas,"Alex Proyas (story), Alex Proyas (screenplay), Lem Dobbs (screenplay), David S. Goyer (screenplay)","Rufus Sewell, William Hurt, Kiefer Sutherland, Jennifer Connelly","A man struggles with memories of his past, which includes a wife he cannot remember, and a nightmarish world, no one else seems to be waking up from.",English,"Australia, USA",12 wins & 18 nominations.,https://m.media-amazon.com/images/M/MV5BMGExOGExM2UtNWM5ZS00OWEzLTllNzYtM2NlMTJlYjBlZTJkXkEyXkFqcGdeQXVyMTQxNzMzNDI@._V1_SX300.jpg,66,7.6,"183,626",tt0118929,movie,25 Apr 2000,N/A,York,N/A,True,7.6/10,,66/100,,,,
0,The Leading Man,1996,R,06 Mar 1998,100 min,"Drama, Romance, Thriller",John Duigan,Virginia Duigan,"Jon Bon Jovi, Anna Galiena, Lambert Wilson, Thandie Newton","Successful playwright Felix Webb has a new play, 'The Hit Man', in rehearsal. Directed by his old friend Humphrey, it is already being hailed as a masterpiece; but Felix can't enjoy his ...",English,UK,N/A,https://m.media-amazon.com/images/M/MV5BMDQ1OWExNmUtOTllZi00ZTkzLWE5ZDYtZjllYjQ3ZDdkNjMzXkEyXkFqcGdeQXVyMTQxNzMzNDI@._V1_SX300.jpg,N/A,5.7,"1,388",tt0116845,movie,N/A,N/A,N/A,N/A,True,5.7/10,69%,,,,,
0,Star Kid,1997,PG,16 Jan 1998,101 min,"Adventure, Family, Sci-Fi",Manny Coto,Manny Coto,"Joseph Mazzello, Joey Simmrin, Alex Daniels, Arthur Burghardt",Shy seventh-grader Spencer Griffith's life changes when a meteor falls into a local junkyard and he finds a Cybersuit - an exoskeleton with AI from another galaxy. Spencer puts on the ...,English,USA,N/A,https://m.media-amazon.com/images/M/MV5BOTk4NWE4ZWQtZmNjZi00ZmU1LTkwMGUtNTM2YzY4MjU4ZTYxXkEyXkFqcGdeQXVyNzc5MjA3OA@@._V1_SX300.jpg,N/A,5.3,"2,345",tt0120478,movie,N/A,N/A,N/A,N/A,True,5.3/10,43%,,,,,
0,A Hard Rain's Gonna Fall,2008,N/A,17 Dec 2008,43 min,"Drama, Sport",Michael Waxman,"Peter Berg (developed for television by), Buzz Bissinger (book), Bridget Carpenter, Patrick Massett, John Zinman","Kyle Chandler, Connie Britton, Zach Gilford, Minka Kelly","Buddy tries to use Tim to get to Lila, who's still mad about losing her college fund to a business deal and it gets worse when she finds she's been accepted by the college she's always ...",English,USA,N/A,https://m.media-amazon.com/images/M/MV5BMTYwNjIyMTYwOV5BMl5BanBnXkFtZTcwMTA2MDU1MQ@@._V1_SX300.jpg,N/A,8.0,139,tt1216620,episode,,,,,True,8.0/10,,,,N/A,N/A,N/A
0,Half Baked,1998,R,16 Jan 1998,82 min,"Comedy, Crime",Tamra Davis,"Dave Chappelle, Neal Brennan","Dave Chappelle, Guillermo Díaz, Jim Breuer, Harland Williams",The story of three not so bright men who come up with a series of crazy schemes to get a friend out of jail.,"English, Turkish",USA,N/A,https://m.media-amazon.com/images/M/MV5BZWMxZWE1ZjQtYzAyNS00NjEwLTgwM2ItMWI2NWVhZGJiYjk3XkEyXkFqcGdeQXVyMTQxNzMzNDI@._V1_SX300.jpg,16,6.7,"56,601",tt0120693,movie,N/A,N/A,N/A,N/A,True,6.7/10,29%,16/100,,,,
0,Fallen,1998,R,16 Jan 1998,124 min,"Action, Crime, Drama, Fantasy, Mystery, Thriller",Gregory Hoblit,Nicholas Kazan,"Denzel Washington, John Goodman, Donald Sutherland, Embeth Davidtz","Homicide detective John Hobbes witnesses the execution of serial killer Edgar Reese. Soon after the execution the killings start again, and they are very similar to Reese's style.","English, Syriac, Assyrian Neo-Aramaic",USA,3 nominations.,https://m.media-amazon.com/images/M/MV5BY2Q1OGI4ZGQtMzc3OS00YzIyLThhNWQtYWUxODc3NzU0YWQ4L2ltYWdlL2ltYWdlXkEyXkFqcGdeQXVyMTQxNzMzNDI@._V1_SX300.jpg,N/A,7.0,"72,023",tt0119099,movie,N/A,N/A,N/A,N/A,True,7.0/10,40%,,,,,
0,Shooting Fish,1997,PG,01 May 1998,103 min,"Comedy, Crime, Romance",Stefan Schwartz,"Stefan Schwartz, Richard Holmes","Rowena Cooper, Scott Charles, Antonia Corrigan, Myles Anderson",Two con artists' plan to steal enough for a house are twisted when a pretty girl enters the picture.,English,UK,3 wins.,https://m.media-amazon.com/images/M/MV5BZDY0Yzk0YTItMDNkNC00MjM2LTk0NTAtZWMwNGZkMDA4Y2Q0XkEyXkFqcGdeQXVyODY0NzcxNw@@._V1_SX300.jpg,47,6.6,"7,235",tt0120122,movie,N/A,N/A,N/A,N/A,True,6.6/10,57%,47/100,,,,
0,The Prophecy II,1998,R,20 Jan 1998,87 min,"Fantasy, Horror, Thriller",Greg Spence,"Gregory Widen (characters), Matt Greenberg, Greg Spence","Christopher Walken, Russell Wong, Jennifer Beals, Brittany Murphy","Gabriel returns to try to destroy the human race he despises so much, with the help of a suicidal teen and the opposition of the angel Danyael.","English, Latin, Spanish",USA,2 nominations.,https://m.media-amazon.com/images/M/MV5BMTJlYjQyM2UtMjZhYy00ZDBkLTk5ZGItN2E3MjI2NjJhODM5XkEyXkFqcGdeQXVyMTQxNzMzNDI@._V1_SX300.jpg,N/A,5.8,"6,839",tt0118643,movie,N/A,N/A,N/A,N/A,True,5.8/10,33%,,,,,
0,Fallen Angels,1995,R,30 Jan 1998,99 min,"Comedy, Crime, Drama, Romance",Kar-Wai Wong,Kar-Wai Wong,"Leon Lai, Michelle Reis, Takeshi Kaneshiro, Charlie Yeung","This Hong Kong-set crime drama follows the lives of a hitman, hoping to get out of the business, and his elusive female partner.","Min Nan, Japanese, English, Cantonese, Mandarin",Hong Kong,8 wins & 15 nominations.,https://m.media-amazon.com/images/M/MV5BMTc3NzI0MzQ3M15BMl5BanBnXkFtZTcwMzA0MDMzNA@@._V1_SX300.jpg,71,7.7,"23,631",tt0112913,movie,N/A,N/A,N/A,N/A,True,7.7/10,95%,71/100,,,,
0,Four Days in September,1997,R,30 Jan 1998,110 min,"Action, Drama, History, Thriller",Bruno Barreto,"Fernando Gabeira (novel), Leopoldo Serran","Alan Arkin, Fernanda Torres, Pedro Cardoso, Luiz Fernando Guimarães","Fernando, a journalist, and his friend César join terrorist group MR8 in order to fight Brazilian dictatorial regime during the late sixties. Cesare, however, is wounded and captured during...","Portuguese, English","Brazil, USA",Nominated for 1 Oscar. Another 2 wins & 3 nominations.,https://m.media-amazon.com/images/M/MV5BNWYxNWFjNjgtYzM1OS00NDllLWEyN2EtNTBiZGRiOTA5MWYwXkEyXkFqcGdeQXVyMTQxNzMzNDI@._V1_SX300.jpg,N/A,7.4,"4,154",tt0119815,movie,N/A,N/A,N/A,N/A,True,7.4/10,59%,,,,,
0,Spice World,1997,PG,23 Jan 1998,93 min,"Comedy, Family, Music",Bob Spiers,"Spice Girls (idea), Kim Fuller (idea), Kim Fuller, Jamie Curtis (additional writing)","Mel B, Emma Bunton, Melanie C, Geri Horner",World famous pop group the Spice Girls zip around London in their luxurious double decker tour bus having various adventures and performing for their fans.,English,UK,3 wins & 11 nominations.,https://m.media-amazon.com/images/M/MV5BY2FiZjA1ODQtOWNjMC00ZmM4LThiNjktZmQ3YjBhMGQ2NzI2XkEyXkFqcGdeQXVyODU4NTYwMDA@._V1_SX300.jpg,32,3.5,"32,466",tt0120185,movie,N/A,N/A,N/A,N/A,True,3.5/10,35%,32/100,,,,
0,Deep Rising,1998,R,30 Jan 1998,106 min,"Action, Adventure, Horror, Sci-Fi",Stephen Sommers,Stephen Sommers,"Treat Williams, Famke Janssen, Anthony Heald, Kevin J. O'Connor","A group of heavily armed hijackers board a luxury ocean liner in the South Pacific Ocean to loot it, only to do battle with a series of large-sized, tentacled, man-eating sea creatures who had already invaded the ship.","English, Korean","USA, Canada",2 nominations.,https://m.media-amazon.com/images/M/MV5BMTJmY2ZiNzMtNTBhOC00MDlkLWJlYzUtYWIyNDAyZDM1OWQ0XkEyXkFqcGdeQXVyMTQxNzMzNDI@._V1_SX300.jpg,N/A,6.1,"32,310",tt0118956,movie,N/A,N/A,N/A,N/A,True,6.1/10,29%,,,,,
0,A Letter from Death Row,1998,R,17 Nov 1998,89 min,"Crime, Drama, Mystery","Marvin Baker, Bret Michaels",Bret Michaels,"Bret Michaels, Martin Sheen, Kristi Gibson, Simon Elsworth","A psychological thriller (...or is it?) that takes you through the mind of convicted killer, Michael Raine, and his experiences on death row... or does it? Was he guilty of killing his ...",English,USA,N/A,https://ia.media-imdb.com/images/M/MV5BMTAwNjk2MTUzNTReQTJeQWpwZ15BbWU3MDAwNzMxNDE@._V1_SX300.jpg,N/A,4.1,505,tt0119521,movie,N/A,N/A,N/A,N/A,True,4.1/10,,,,,,
0,Music from Another Room,1998,PG-13,12 Nov 1998,104 min,"Comedy, Drama, Romance",Charlie Peters,Charlie Peters,"Jude Law, Jennifer Tilly, Gretchen Mol, Martha Plimpton","Music From Another Room is a romantic comedy that follows the exploits of Danny, a young man who grew up believing he was destined to marry the girl he helped deliver as a five year old boy...",English,USA,N/A,https://m.media-amazon.com/images/M/MV5BMTMwNjc1NTYxNl5BMl5BanBnXkFtZTcwNTQ5MjYxMQ@@._V1_SX300.jpg,N/A,6.4,"4,689",tt0119734,movie,07 Jan 2003,N/A,MGM Home Entertainment,N/A,True,6.4/10,33%,,,,,
0,The Replacement Killers,1998,R,06 Feb 1998,87 min,"Action, Crime, Thriller",Antoine Fuqua,Ken Sanzel,"Yun-Fat Chow, Mira Sorvino, Michael Rooker, Kenneth Tsang","A troubled hitman seeks aid from a forger to help him get papers to China. However, the drug lord has hired replacements to finish the job, and kill the hitman.","English, Cantonese",USA,1 nomination.,https://m.media-amazon.com/images/M/MV5BYmM5YmI0NzYtNDViNi00MzIwLWJhOGUtZTJmMmY5ZmUzZmQ3XkEyXkFqcGdeQXVyNDk3NzU2MTQ@._V1_SX300.jpg,42,6.2,"26,356",tt0120008,movie,N/A,N/A,N/A,N/A,True,6.2/10,37%,42/100,,,,
0,B. Monkey,1998,R,15 Jul 1999,92 min,"Crime, Drama, Romance, Thriller",Michael Radford,"Andrew Davies (novel), Chloe King, Michael Radford, Michael Thomas","Asia Argento, Jared Harris, Rupert Everett, Jonathan Rhys Meyers",A young woman attempts to end her criminal career. But she needs love to make it.,"English, Italian, French","UK, USA",N/A,https://m.media-amazon.com/images/M/MV5BMTM5MzIzMDAxNV5BMl5BanBnXkFtZTcwNTc2NzAyMQ@@._V1_SX300.jpg,49,5.9,"3,220",tt0120594,movie,21 Mar 2000,N/A,Miramax,N/A,True,5.9/10,63%,49/100,,,,
0,The Night Flier,1997,R,06 Feb 1998,94 min,"Fantasy, Horror, Mystery",Mark Pavia,"Stephen King (story), Mark Pavia (screenplay), Jack O'Donnell (screenplay)","Miguel Ferrer, Julie Entwisle, Dan Monahan, Michael H. Moss",A reporter is on the trail of a vampiric murderer who travels by plane.,English,"USA, Italy",1 win & 2 nominations.,https://m.media-amazon.com/images/M/MV5BMWM0OTY1YWItYTY2ZC00MzVhLTliM2ItNzJiMzIxMDJhMDI3XkEyXkFqcGdeQXVyMTQxNzMzNDI@._V1_SX300.jpg,36,6.0,"9,221",tt0119784,movie,N/A,N/A,N/A,N/A,True,6.0/10,33%,36/100,,,,
0,Blues Brothers 2000,1998,PG-13,06 Feb 1998,123 min,"Action, Comedy, Crime, Music, Musical",John Landis,"Dan Aykroyd (film The Blues Brothers), John Landis (film The Blues Brothers), Dan Aykroyd, John Landis","Walter Levine, Dan Aykroyd, Tom Davis, Frank Oz","Elwood must reunite the old band, with a few new members, and go on another ""Mission from God.""","English, Russian",USA,4 nominations.,https://m.media-amazon.com/images/M/MV5BMGUyODE5ODAtZTIzNy00NDg4LTlhOTQtMTQ0MzU0MTdmZDFmXkEyXkFqcGdeQXVyMTQxNzMzNDI@._V1_SX300.jpg,N/A,4.9,"30,793",tt0118747,movie,N/A,N/A,N/A,N/A,True,4.9/10,46%,,,,,
0,Tokyo Fist,1995,N/A,22 May 1998,87 min,"Action, Drama, Thriller",Shin'ya Tsukamoto,"Hisashi Saito (story), Shin'ya Tsukamoto (story), Shin'ya Tsukamoto (screenplay)","Kaori Fujii, Shin'ya Tsukamoto, Kôji Tsukamoto, Naomasa Musaka","Suspecting that his childhood friend, a professional boxer, is having an affair with his fiancee, a businessman starts training rigorously himself in order to take him down.","Japanese, English",Japan,2 wins & 2 nominations.,https://m.media-amazon.com/images/M/MV5BOTAzMTkxZDktODllMi00NmIwLWFiZGEtY2FiNTE2OTIxMWM4XkEyXkFqcGdeQXVyMTMxMTY0OTQ@._V1_SX300.jpg,N/A,7.1,"2,749",tt0114690,movie,N/A,N/A,N/A,N/A,True,7.1/10,,,,,,
0,Zardoz,1974,R,06 Feb 1974,105 min,"Adventure, Fantasy, Sci-Fi",John Boorman,John Boorman,"Sean Connery, Charlotte Rampling, Sara Kestelman, John Alderton","In the distant future, a savage trained only to kill finds a way into the community of bored immortals that alone preserves humanity's achievements.","English, Italian, Swedish, Latin, German, French, Irish","UK, USA, Ireland",Nominated for 1 BAFTA Film Award. Another 1 nomination.,https://m.media-amazon.com/images/M/MV5BMDg5NTYzNzMtNzhmOS00NzEyLWJlMWMtMzUzNjdhYjY2NDI3XkEyXkFqcGdeQXVyNjUwMzI2NzU@._V1_SX300.jpg,46,5.9,"18,508",tt0070948,movie,N/A,N/A,N/A,N/A,True,5.9/10,48%,46/100,,,,
0,Joy Ride,2001,R,05 Oct 2001,97 min,"Mystery, Thriller",John Dahl,"Clay Tarver, J.J. Abrams","Steve Zahn, Paul Walker, Leelee Sobieski, Jessica Bowman","Three young people on a road trip from Colorado to New Jersey talk to a trucker on their CB radio, then must escape when he turns out to be a psychotic killer.",English,USA,5 nominations.,https://m.media-amazon.com/images/M/MV5BMzQ2N2NlNWQtY2Q1Mi00ZTc3LWE5YmMtNGVjMjYxODRjOGZjXkEyXkFqcGdeQXVyMTQxNzMzNDI@._V1_SX300.jpg,75,6.6,"62,518",tt0206314,movie,N/A,N/A,N/A,N/A,True,6.6/10,74%,75/100,,,,
0,The Wedding Singer,1998,PG-13,13 Feb 1998,97 min,"Comedy, Music, Romance",Frank Coraci,Tim Herlihy,"Adam Sandler, Drew Barrymore, Christine Taylor, Allen Covert","Robbie, a singer, and Julia, a waitress, are both engaged, but to the wrong people. Fortune intervenes to help them discover each other.",English,USA,5 wins & 7 nominations.,https://m.media-amazon.com/images/M/MV5BYjM5YTQ0ZGYtMWExZi00MTFmLTg0YjUtZDcyMGNiYzE5MmNmL2ltYWdlXkEyXkFqcGdeQXVyMTQxNzMzNDI@._V1_SX300.jpg,59,6.8,"129,995",tt0120888,movie,N/A,N/A,N/A,N/A,True,6.8/10,68%,59/100,,,,
0,Sphere,1998,PG-13,13 Feb 1998,134 min,"Action, Mystery, Sci-Fi, Thriller",Barry Levinson,"Michael Crichton (novel), Kurt Wimmer (adaptation), Stephen Hauser (screenplay), Paul Attanasio (screenplay)","Dustin Hoffman, Sharon Stone, Samuel L. Jackson, Peter Coyote",A spaceship is discovered under three hundred years' worth of coral growth at the bottom of the ocean.,English,USA,3 nominations.,https://m.media-amazon.com/images/M/MV5BMTYyMTBlM2UtNWE1Ni00ZDg4LTliODQtYTFhZWIwNTAyNTg3L2ltYWdlL2ltYWdlXkEyXkFqcGdeQXVyMTQxNzMzNDI@._V1_SX300.jpg,35,6.1,"96,909",tt0120184,movie,N/A,N/A,N/A,N/A,True,6.1/10,12%,35/100,,,,
0,Ayn Rand: A Sense of Life,1997,Not Rated,13 Feb 1998,145 min,"Documentary, Biography",Michael Paxton,Michael Paxton,"Sharon Gless, Michael S. Berliner, Harry Binswanger, Sylvia Bokor","A documentary focusing on the life of novelist and philosopher Ayn Rand, the author of the bestselling novels The Fountainhead and Atlas Shrugged and originator of the Objectivist philosophy.",English,USA,Nominated for 1 Oscar. Another 1 win & 1 nomination.,https://m.media-amazon.com/images/M/MV5BMTI0ODQ0NzczNF5BMl5BanBnXkFtZTcwNDIyNTAyMQ@@._V1_SX300.jpg,N/A,6.5,527,tt0118662,movie,N/A,N/A,N/A,N/A,True,6.5/10,50%,,,,,
0,The Break,1997,R,20 Feb 1998,96 min,"Drama, Romance, Thriller",Robert Dornhelm,"Ronan Bennett (screenplay), Stephen Rea (idea by)","Stephen Rea, Alfred Molina, Rosana Pastor, Brendan Gleeson","Dowd, who's IRA, escapes an Irish prison in a bloody jailbreak, making his way to New York City where he lives alone, avoids Irish hangouts, and works as a dishwasher. When a good deed gets...","English, Irish, Spanish","UK, Spain, Germany, Ireland, Japan",1 nomination.,https://m.media-amazon.com/images/M/MV5BMTMxNzg1MjEzNF5BMl5BanBnXkFtZTYwMDY4Mjg5._V1_SX300.jpg,N/A,5.8,332,tt0116379,movie,N/A,N/A,N/A,N/A,True,5.8/10,67%,,,,,
0,Little City,1997,R,20 Feb 1998,90 min,"Comedy, Romance",Roberto Benabib,Roberto Benabib,"Jon Bon Jovi, Penelope Ann Miller, Joe Bellan, Robert Elross","San Francisco is a little city, where you keep running into the same 6 people, here 5 around 30 y.o. and a cougar on the prowl for young women, all going in and out of relationships.",English,USA,N/A,https://m.media-amazon.com/images/M/MV5BMjE2MTY2MzUwNV5BMl5BanBnXkFtZTcwMzI5MTAyMQ@@._V1_SX300.jpg,N/A,5.8,956,tt0119548,movie,N/A,N/A,N/A,N/A,True,5.8/10,,,,,,
0,Palmetto,1998,R,20 Feb 1998,114 min,"Crime, Drama, Mystery, Romance, Thriller",Volker Schlöndorff,"James Hadley Chase (novel), E. Max Frye (screenplay)","Woody Harrelson, Elisabeth Shue, Gina Gershon, Rolf Hoppe",A recently released ex-con gets involved in a fake kidnapping scheme that turns very real.,English,"Germany, USA",N/A,https://m.media-amazon.com/images/M/MV5BZGE2MDU2ZmEtYWY0MC00ZDc1LWJmZTItMDFkZmYzYmViODZkXkEyXkFqcGdeQXVyNjU0NTI0Nw@@._V1_SX300.jpg,43,6.1,"7,362",tt0120782,movie,N/A,N/A,N/A,N/A,True,6.1/10,39%,43/100,,,,
0,As Good as It Gets,1997,PG-13,25 Dec 1997,139 min,"Comedy, Drama, Romance",James L. Brooks,"Mark Andrus (story), Mark Andrus (screenplay), James L. Brooks (screenplay)","Jack Nicholson, Helen Hunt, Greg Kinnear, Cuba Gooding Jr.","A single mother and waitress, a misanthropic author, and a gay artist form an unlikely friendship after the artist is assaulted in a robbery.",English,USA,Won 2 Oscars. Another 36 wins & 53 nominations.,https://m.media-amazon.com/images/M/MV5BNWMxZTgzMWEtMTU0Zi00NDc5LWFkZjctMzUxNDIyNzZiMmNjXkEyXkFqcGdeQXVyMTQxNzMzNDI@._V1_SX300.jpg,67,7.7,"267,139",tt0119822,movie,N/A,N/A,N/A,N/A,True,7.7/10,85%,67/100,,,,
0,King of New York,1990,R,29 Aug 1991,103 min,"Crime, Thriller",Abel Ferrara,Nicholas St. John,"Christopher Walken, David Caruso, Laurence Fishburne, Victor Argo",A drug kingpin is released from prison and seeks to take total control of the criminal underworld in order to give back to the community.,English,"Italy, USA",1 win & 2 nominations.,https://m.media-amazon.com/images/M/MV5BOTE2NDcxNzE4N15BMl5BanBnXkFtZTgwMDc1NTk4NjE@._V1_SX300.jpg,66,7.0,"30,236",tt0099939,movie,N/A,N/A,N/A,N/A,True,7.0/10,73%,66/100,,,,
0,Men with Guns,1997,R,27 Mar 1998,127 min,"Adventure, Drama",John Sayles,John Sayles,"Federico Luppi, Damián Delgado, Dan Rivera González, Tania Cruz","Humberto Fuentes is a wealthy doctor whose wife has recently died. In spite of the advice of his children, he takes a trip to visit his former students who now work in impoverished villages...","Spanish, Italian, English, Nahuatl, Maya, Tzotzil, Kuna","USA, Mexico",Nominated for 1 Golden Globe. Another 4 wins & 3 nominations.,https://m.media-amazon.com/images/M/MV5BODAxYzg4YjItYWRiMS00YWJjLTk5ZmMtNjNiYmY2MTM4ZGIxXkEyXkFqcGdeQXVyNjMwMjk0MTQ@._V1_SX300.jpg,N/A,7.5,"2,550",tt0119657,movie,N/A,N/A,N/A,N/A,True,7.5/10,89%,,,,,
0,The Sadness of Sex,1998,N/A,06 Mar 1998,87 min,"Comedy, Romance",Rupert Wainwright,"Barry Yourgrau (book), Barry Yourgrau (screenplay)","Barry Yourgrau, Peta Wilson, Barbara Baumann, Mark Benesh","Comprised of fifteen vignettes of varying lengths, The Sadness of Sex (1998) is about love, but more specifically about the phases of courtship that lead to the inevitable break-up.",English,Canada,N/A,https://m.media-amazon.com/images/M/MV5BMTEwMTY0NTk4NzReQTJeQWpwZ15BbWU3MDAzNzY4MDM@._V1_SX300.jpg,N/A,6.7,90,tt0114322,movie,N/A,N/A,N/A,N/A,True,6.7/10,,,,,,
0,Twilight,2008,PG-13,21 Nov 2008,122 min,"Drama, Fantasy, Romance",Catherine Hardwicke,"Melissa Rosenberg (screenplay), Stephenie Meyer (novel)","Kristen Stewart, Sarah Clarke, Matt Bushell, Billy Burke","Bella Swan moves to Forks and encounters Edward Cullen, a gorgeous boy with a secret.",English,USA,29 wins & 15 nominations.,https://m.media-amazon.com/images/M/MV5BMTQ2NzUxMTAxN15BMl5BanBnXkFtZTcwMzEyMTIwMg@@._V1_SX300.jpg,56,5.2,"410,044",tt1099212,movie,N/A,N/A,N/A,N/A,True,5.2/10,49%,56/100,,,,
