,Title,Year,Rated,Released,Runtime,Genre,Director,Writer,Actors,Plot,Language,Country,Awards,Poster,Metascore,imdbRating,imdbVotes,imdbID,Type,DVD,BoxOffice,Production,Website,Response,Internet Movie Database,Rotten Tomatoes,Metacritic,totalSeasons,Season,Episode,seriesID
0,The Cure,1995,PG-13,21 Apr 1995,97 min,Drama,Peter Horton,Robert Kuhn,"Brad Renfro, Aeryk Egan, Delphine French, Mona Powell","Erik, a loner, finds a friend in Dexter, an eleven-year-old boy with AIDS. They vow to find a cure for AIDS together and save Dexter's life in an eventful summer.",English,USA,2 wins & 3 nominations.,https://m.media-amazon.com/images/M/MV5BYjIyOGNkNTgtYmM4Mi00NDU4LTgzZTQtYWJlZjUxZjA2NmI4XkEyXkFqcGdeQXVyNTc1NTQxODI@._V1_SX300.jpg,N/A,7.7,"8,884",tt0112757,movie,N/A,N/A,N/A,N/A,True,7.7/10,45%,,,,,
0,Castle Freak,1995,R,14 Nov 1995,90 min,"Drama, Horror, Mystery, Thriller",Stuart Gordon,"Stuart Gordon (story), H.P. Lovecraft (story ""The Outsider""), Dennis Paoli (screenplay), Dennis Paoli (story)","Jeffrey Combs, Barbara Crampton, Jonathan Fuller, Jessica Dollarhide",A man struggles to save his family from the strange and deadly occurrences in the castle they've inherited.,"English, Italian, Swedish",USA,1 win.,https://m.media-amazon.com/images/M/MV5BMTJlOGEzNTctMTk2My00YWQwLWI2MzMtMjMxNTBmZDY4MWE0XkEyXkFqcGdeQXVyMTQxNzMzNDI@._V1_SX300.jpg,N/A,5.9,"6,356",tt0112643,movie,N/A,N/A,N/A,N/A,True,5.9/10,63%,,,,,
0,Circle of Friends,1995,PG-13,07 Apr 1995,103 min,"Drama, Romance",Pat O'Connor,"Andrew Davies (screenplay), Maeve Binchy (novel)","Chris O'Donnell, Minnie Driver, Geraldine O'Rawe, Saffron Burrows","'Circle Of Friends' is set in 1950's Ireland. The movie focuses on Benny Hogan and her best friend, Eve Malone. The story centers around Benny and Eve as they enter student life at ...",English,"Ireland, USA, UK",1 win.,https://m.media-amazon.com/images/M/MV5BZWEzZGJhNmYtOTkyYi00OTJhLWE3NTItOGFiNDEwYTc4Y2U3XkEyXkFqcGdeQXVyNzQ5MzY0NjM@._V1_SX300.jpg,70,6.6,"7,778",tt0112679,movie,N/A,N/A,N/A,N/A,True,6.6/10,78%,70/100,,,,
0,Clerks,1994,R,09 Nov 1994,92 min,Comedy,Kevin Smith,Kevin Smith,"Brian O'Halloran, Jeff Anderson, Marilyn Ghigliotti, Lisa Spoonauer","A day in the lives of two convenience clerks named Dante and Randal as they annoy customers, discuss movies, and play hockey on the store roof.",English,USA,6 wins & 10 nominations.,https://m.media-amazon.com/images/M/MV5BNzE1Njk0NmItNDhlMC00ZmFlLWI4ZTUtYTY4ZjgzNjkyMTU1XkEyXkFqcGdeQXVyMTQxNzMzNDI@._V1_SX300.jpg,70,7.7,"208,034",tt0109445,movie,N/A,N/A,N/A,N/A,True,7.7/10,88%,70/100,,,,
0,Don Juan DeMarco,1994,PG-13,07 Apr 1995,97 min,"Comedy, Drama, Romance",Jeremy Leven,"Lord Byron (character Don Juan), Jeremy Leven","Marlon Brando, Johnny Depp, Faye Dunaway, Géraldine Pailhas","A psychiatrist must cure a young patient that presents himself as Don Juan, the greatest lover in the world.","English, Spanish",USA,Nominated for 1 Oscar. Another 4 wins & 4 nominations.,https://m.media-amazon.com/images/M/MV5BNzRiMGM2ODgtN2Y1Zi00ODk5LThhOTItOWVkODM0YjAyZTI2XkEyXkFqcGdeQXVyNjUwNzk3NDc@._V1_SX300.jpg,63,6.7,"47,036",tt0112883,movie,N/A,N/A,N/A,N/A,True,6.7/10,69%,63/100,,,,
0,Disclosure,1994,R,09 Dec 1994,128 min,"Drama, Thriller",Barry Levinson,"Michael Crichton (novel), Paul Attanasio (screenplay)","Michael Douglas, Demi Moore, Donald Sutherland, Caroline Goodall","A computer specialist is sued for sexual harassment by a former lover turned boss who initiated the act forcefully, which threatens both his career and his personal life.",English,USA,2 wins & 2 nominations.,https://m.media-amazon.com/images/M/MV5BYzhkNjE2YTQtYWQzNS00ZTkwLTg4YzAtNjNlYTRlMGEzYjcxL2ltYWdlXkEyXkFqcGdeQXVyMTQxNzMzNDI@._V1_SX300.jpg,58,6.1,"45,006",tt0109635,movie,N/A,N/A,N/A,N/A,True,6.1/10,58%,58/100,,,,
0,Tucker: The Man and His Dream,1988,PG,12 Aug 1988,110 min,"Biography, Drama",Francis Ford Coppola,"Arnold Schulman, David Seidler","Jeff Bridges, Joan Allen, Martin Landau, Frederic Forrest","The story of Preston Tucker, the maverick car designer and his ill-fated challenge to the auto industry with his revolutionary car concept.",English,USA,Nominated for 3 Oscars. Another 8 wins & 6 nominations.,https://m.media-amazon.com/images/M/MV5BNjIxODE5ZDktZmUxOS00N2IyLWI5MWMtNWFkZjEyMGU3NTM4L2ltYWdlL2ltYWdlXkEyXkFqcGdeQXVyNjc1NTYyMjg@._V1_SX300.jpg,74,6.9,"15,852",tt0096316,movie,N/A,N/A,N/A,N/A,True,6.9/10,83%,74/100,,,,
0,Drop Zone,1994,R,09 Dec 1994,101 min,"Action, Adventure, Thriller",John Badham,"Tony Griffin (story), Guy Manos (story), Peter Barsocchini (story), Peter Barsocchini (screenplay), John Bishop (screenplay)","Wesley Snipes, Gary Busey, Yancy Butler, Michael Jeter",A tough cop teams up with a professional skydiver to capture a renegade computer hacker on the run from the law.,English,USA,N/A,https://m.media-amazon.com/images/M/MV5BNGUyMWNjNGYtZmNhNS00MGQxLTlmYmMtNDE0NDhhNDk3ZTgxXkEyXkFqcGdeQXVyMTQxNzMzNDI@._V1_SX300.jpg,N/A,5.6,"18,642",tt0109676,movie,N/A,N/A,N/A,N/A,True,5.6/10,41%,,,,,
0,Destiny Turns on the Radio,1995,R,28 Apr 1995,102 min,"Crime, Comedy, Fantasy",Jack Baran,"Robert Ramsey, Matthew Stone","Dylan McDermott, Nancy Travis, James Le Gros, Quentin Tarantino","After 3 years in prison, Julian breaks out and returns to Vegas to get his half from the bank robbery and see Lucille again. The Devil took the loot and Tuerto took Lucille.",English,USA,N/A,https://m.media-amazon.com/images/M/MV5BZWQ5YmQ5YWUtMDYyOS00Yzk1LTg2MTktOGVmMDMzODFiMWJlXkEyXkFqcGdeQXVyNjU0NTI0Nw@@._V1_SX300.jpg,N/A,4.5,"2,190",tt0112854,movie,N/A,N/A,N/A,N/A,True,4.5/10,17%,,,,,
0,Death and the Maiden,1994,R,27 Jan 1995,103 min,"Drama, Mystery, Thriller",Roman Polanski,"Ariel Dorfman (play), Rafael Yglesias (screenplay), Ariel Dorfman (screenplay)","Sigourney Weaver, Ben Kingsley, Stuart Wilson, Krystia Mova",A political activist is convinced that her guest is a man who once tortured her for the government.,English,"UK, France",5 nominations.,https://m.media-amazon.com/images/M/MV5BMDYwODA0NDctMzJlOS00ODE2LThmZDUtMzBhNWFjYjUxMjEwXkEyXkFqcGdeQXVyMTE2OTg4Mjg@._V1_SX300.jpg,72,7.3,"21,713",tt0109579,movie,N/A,N/A,N/A,N/A,True,7.3/10,84%,72/100,,,,
0,Dolores Claiborne,1995,R,24 Mar 1995,132 min,"Crime, Drama, Mystery, Thriller",Taylor Hackford,"Stephen King (book), Tony Gilroy (screenplay)","Kathy Bates, Jennifer Jason Leigh, Judy Parfitt, Christopher Plummer",A big-city reporter travels to the small town where her mother has been arrested for the murder of an elderly woman that she works for as a maid.,English,USA,1 win & 8 nominations.,https://m.media-amazon.com/images/M/MV5BNzhkNjFlNDQtMDYxNy00NGU5LWE4YmItOWIyYzg5MTNmNzcxXkEyXkFqcGdeQXVyMTQxNzMzNDI@._V1_SX300.jpg,62,7.4,"37,150",tt0109642,movie,N/A,N/A,N/A,N/A,True,7.4/10,84%,62/100,,,,
0,Dumb and Dumber,1994,PG-13,16 Dec 1994,107 min,Comedy,"Peter Farrelly, Bobby Farrelly","Peter Farrelly, Bennett Yellin, Bobby Farrelly","Jim Carrey, Jeff Daniels, Lauren Holly, Mike Starr","After a woman leaves a briefcase at the airport terminal, a dumb limo driver and his dumber friend set out on a hilarious cross-country road trip to Aspen to return it.","English, Swedish, German",USA,5 wins & 3 nominations.,https://m.media-amazon.com/images/M/MV5BZDQwMjNiMTQtY2UwYy00NjhiLTk0ZWEtZWM5ZWMzNGFjNTVkXkEyXkFqcGdeQXVyMTQxNzMzNDI@._V1_SX300.jpg,41,7.3,"343,953",tt0109686,movie,N/A,N/A,N/A,N/A,True,7.3/10,67%,41/100,,,,
0,Eat Drink Man Woman,1994,Not Rated,03 Aug 1994,124 min,"Comedy, Drama, Romance",Ang Lee,"Ang Lee, James Schamus, Hui-Ling Wang","Sihung Lung, Yu-Wen Wang, Chien-Lien Wu, Kuei-Mei Yang",A senior chef lives with his three grown daughters; the middle one finds her future plans affected by unexpected events and the life changes of the other household members.,"Mandarin, French",Taiwan,Nominated for 1 Oscar. Another 7 wins & 15 nominations.,https://m.media-amazon.com/images/M/MV5BMGEyNDI0OGQtMjY3Yi00NGU5LWFiNTQtNWMyZmJmNDAzMDMwXkEyXkFqcGdeQXVyMTMxMTY0OTQ@._V1_SX300.jpg,N/A,7.8,"17,815",tt0111797,movie,N/A,N/A,N/A,N/A,True,7.8/10,91%,,,,,
0,Exotica,1994,R,24 Mar 1995,103 min,Drama,Atom Egoyan,Atom Egoyan,"Bruce Greenwood, Mia Kirshner, Don McKellar, Elias Koteas","A man plagued by neuroses frequents the club Exotica in an attempt to find solace, but even there his past is never far away.","English, Hebrew",Canada,15 wins & 11 nominations.,https://m.media-amazon.com/images/M/MV5BMGIxN2NiMDYtYjQ0YS00M2ViLTkzYTUtNDdhYWZmOTM0ZmJkXkEyXkFqcGdeQXVyMTQxNzMzNDI@._V1_SX300.jpg,71,7.0,"17,188",tt0109759,movie,N/A,N/A,N/A,N/A,True,7.0/10,97%,71/100,,,,
0,Exit to Eden,1994,R,14 Oct 1994,113 min,"Comedy, Crime, Romance, Thriller",Garry Marshall,"Anne Rice (novel), Deborah Amelon (screenplay), Bob Brunner (screenplay)","Dana Delany, Paul Mercurio, Rosie O'Donnell, Dan Aykroyd","Elliot heads for the sexual fantasy island, Eden. He takes some photos of diamond smugglers. They and undercover cops want the photos and follow him to Eden.",English,USA,1 win & 4 nominations.,https://m.media-amazon.com/images/M/MV5BMDliZWUwYzktMzU1OC00NzNmLThlODYtODhkMTc4MDkyOWE1XkEyXkFqcGdeQXVyMTQ3Njg3MQ@@._V1_SX300.jpg,N/A,4.2,"6,284",tt0109758,movie,N/A,N/A,N/A,N/A,True,4.2/10,6%,,,,,
0,Ed Wood,1994,R,07 Oct 1994,127 min,"Biography, Comedy, Drama",Tim Burton,"Rudolph Grey (book), Scott Alexander, Larry Karaszewski","Johnny Depp, Martin Landau, Sarah Jessica Parker, Patricia Arquette","Ambitious but troubled movie director Edward D. Wood Jr. tries his best to fulfill his dreams, despite his lack of talent.",English,USA,Won 2 Oscars. Another 25 wins & 34 nominations.,https://m.media-amazon.com/images/M/MV5BNTA5ZjdjNWUtZGUwNy00N2RhLWJiZmItYzFhYjU1NmYxNjY4XkEyXkFqcGdeQXVyMTQxNzMzNDI@._V1_SX300.jpg,70,7.8,"161,533",tt0109707,movie,N/A,N/A,N/A,N/A,True,7.8/10,92%,70/100,,,,
0,French Kiss,1995,PG-13,05 May 1995,111 min,"Comedy, Drama, Romance",Lawrence Kasdan,Adam Brooks,"Meg Ryan, Kevin Kline, Timothy Hutton, Jean Reno","A woman flies to France to confront her straying fiancee, but gets into trouble when the charming crook seated next to her uses her for smuggling.","English, French","UK, USA",2 nominations.,https://m.media-amazon.com/images/M/MV5BMTkzMjg5MDQ3M15BMl5BanBnXkFtZTgwOTM5NTE0MDE@._V1_SX300.jpg,50,6.6,"45,736",tt0113117,movie,N/A,N/A,N/A,N/A,True,6.6/10,48%,50/100,,,,
0,Forget Paris,1995,PG-13,19 May 1995,101 min,"Comedy, Romance",Billy Crystal,"Billy Crystal, Lowell Ganz, Babaloo Mandel","Billy Crystal, Debra Winger, Joe Mantegna, Cynthia Stevenson","Mickey, an NBA referee, meets Ellen, an American airline official, in Paris. It develops into a relationship of ups and downs.",English,USA,1 win.,https://m.media-amazon.com/images/M/MV5BM2ZkYTUxZjQtODhkMy00NWI3LWFlMDMtMzYzZTQ3YmFjMjg4XkEyXkFqcGdeQXVyMTQxNzMzNDI@._V1_SX300.jpg,N/A,6.5,"11,116",tt0113097,movie,N/A,N/A,N/A,N/A,True,6.5/10,50%,,,,,
0,Far from Home: The Adventures of Yellow Dog,1995,PG,13 Jan 1995,81 min,"Adventure, Family",Phillip Borsos,Phillip Borsos,"Mimi Rogers, Bruce Davison, Jesse Bradford, Tom Bower","Teenage Angus adopts a stray dog and names him Yellow. Several days later, while traveling along the coast of British Columbia with Angus' father, John, the boy and dog become stranded when...",English,USA,3 nominations.,https://m.media-amazon.com/images/M/MV5BYThiMDFmYWUtNTdjZC00ODcwLTgzNzgtMTE0MmMxZDg3Njg0XkEyXkFqcGdeQXVyNzc5MjA3OA@@._V1_SX300.jpg,N/A,6.4,"2,492",tt0113028,movie,11 Mar 2003,N/A,Kagan Company Radio Telegraph,N/A,True,6.4/10,57%,,,,,
0,A Goofy Movie,1995,G,07 Apr 1995,78 min,"Animation, Adventure, Comedy, Family, Musical, Romance",Kevin Lima,"Jymn Magon (story), Jymn Magon (screenplay), Chris Matheson (screenplay), Brian Pimental (screenplay), Brian Pimental (story supervisor), Curtis Armstrong (additional written material), John Doolittle (additional written material)","Bill Farmer, Jason Marsden, Jim Cummings, Kellie Martin","When Max makes a preposterous promise to a girl he has a crush on, his chances to fulfilling it seem hopeless when he is dragged onto a cross-country trip with his embarrassing father, Goofy.",English,"USA, Australia, France, Canada",5 nominations.,https://m.media-amazon.com/images/M/MV5BZDczYjU4MDMtY2RjMy00Y2UyLWE2MmMtZjliYWUwNzQ3YjExXkEyXkFqcGdeQXVyMTQxNzMzNDI@._V1_SX300.jpg,N/A,6.8,"44,050",tt0113198,movie,N/A,N/A,N/A,N/A,True,6.8/10,59%,,,,,
0,Hideaway,1995,R,03 Mar 1995,106 min,"Fantasy, Horror, Thriller",Brett Leonard,"Dean R. Koontz (novel), Andrew Kevin Walker (screenplay), Neal Jimenez (screenplay)","Jeff Goldblum, Christine Lahti, Alicia Silverstone, Jeremy Sisto","Hatch gets a special resuscitative medicine after ""dying"" in a car accident. His wife and daughter only get minor injuries. He gets strange nightmares such as killing a teen girl. Is it just dreams?",English,USA,1 nomination.,https://m.media-amazon.com/images/M/MV5BMmM1OTU2MDQtZWVjMi00NmY4LWI1ZDYtZTg0ODE5YTUxNDA1XkEyXkFqcGdeQXVyNTAyODkwOQ@@._V1_SX300.jpg,N/A,5.3,"6,129",tt0113303,movie,N/A,N/A,N/A,N/A,True,5.3/10,20%,,,,,
0,Fluke,1995,PG,02 Jun 1995,96 min,"Drama, Family, Fantasy",Carlo Carlei,"James Herbert (novel), Carlo Carlei (screenplay), James Carrington (screenplay)","Samuel L. Jackson, Matthew Modine, Nancy Travis, Eric Stoltz","After a man dies in a car crash, he is reincarnated as a dog and attempts to reconnect with his family.",English,USA,2 nominations.,https://m.media-amazon.com/images/M/MV5BODM0ZTQ2ZGYtNmNlMi00OGU3LTgyMjQtYmVlOGNlYWQ2Y2Y3L2ltYWdlXkEyXkFqcGdeQXVyNjg4NzYzMzA@._V1_SX300.jpg,N/A,6.7,"6,294",tt0113089,movie,N/A,N/A,N/A,N/A,True,6.7/10,27%,,,,,
0,Farinelli,1994,R,17 Mar 1995,111 min,"Biography, Drama, Music",Gérard Corbiau,"Andrée Corbiau (original scenario), Gérard Corbiau (original scenario), Marcel Beaulieu (adaptation), Andrée Corbiau (adaptation), Gérard Corbiau (adaptation), Andrée Corbiau (dialogue)","Stefano Dionisi, Enrico Lo Verso, Elsa Zylberstein, Caroline Cellier","The story of castrato opera singer Carlo Broschi, who enthralled 18th century European audiences under his stage name Farinelli, comes to life in this drama of high notes and even higher passions.","French, Italian","France, Italy, Belgium, UK",Nominated for 1 Oscar. Another 6 wins & 3 nominations.,https://m.media-amazon.com/images/M/MV5BMmE5MjllZDYtNGVmZS00YjBiLWExMDctYjMyNjUxMjY5ZGU3XkEyXkFqcGdeQXVyNjMwMjk0MTQ@._V1_SX300.jpg,N/A,6.8,"6,128",tt0109771,movie,22 Aug 2000,N/A,Sony Pictures Home Entertainment,N/A,True,6.8/10,58%,,,,,
0,Flash Gordon,1980,PG,05 Dec 1980,111 min,"Action, Adventure, Sci-Fi",Mike Hodges,"Lorenzo Semple Jr. (screenplay), Michael Allin (adaptation), Alex Raymond (based on the characters created by)","Sam J. Jones, Melody Anderson, Max von Sydow, Topol",A football player and his friends travel to the planet Mongo and find themselves fighting the tyranny of Ming the Merciless to save Earth.,English,UK,Nominated for 2 BAFTA Film Awards. Another 2 wins & 10 nominations.,https://m.media-amazon.com/images/M/MV5BN2Y4ZDBjMjEtZWQ0OS00NzYyLTg0M2ItMmUzYTEwN2RmMGVlXkEyXkFqcGdeQXVyMjgyOTI1ODY@._V1_SX300.jpg,58,6.5,"48,333",tt0080745,movie,N/A,N/A,N/A,N/A,True,6.5/10,80%,58/100,,,,
0,Gumby: The Movie,1995,G,01 Dec 1995,90 min,"Animation, Adventure, Comedy, Family, Fantasy, Music, Sci-Fi, Western",Art Clokey,"Art Clokey, Gloria Clokey, Art Clokey (script)","Dal McKennon, Art Clokey, Gloria Clokey, Manny La Carruba","In this offshoot of the 1950s ""claymation"" cartoon series, the crazy Blockheads threaten to ruin Gumby's benefit concert by replacing the entire city of Clokeytown with robots.",English,USA,N/A,https://m.media-amazon.com/images/M/MV5BNjU0ODM1MjExOF5BMl5BanBnXkFtZTcwNDY0ODcyMg@@._V1_SX300.jpg,N/A,6.3,715,tt0113234,movie,N/A,N/A,N/A,N/A,True,6.3/10,,,,,,
0,The Glass Shield,1994,PG-13,02 Jun 1995,109 min,"Crime, Drama",Charles Burnett,"Charles Burnett, John Eddie Johnson (screenplay ""One of Us""), Ned Welsh (screenplay ""One of Us"")","Erich Anderson, Richard Anderson, Thomas Babson, Monty Bane",Two cops become compelled to act against corruption and discrimination within their police precinct.,English,"France, USA",1 nomination.,https://m.media-amazon.com/images/M/MV5BNzdkNTg5YWQtNGI4Mi00NTIzLTkzNTItYTFjM2JhYTgwYzc1XkEyXkFqcGdeQXVyNjU5MjcxOTg@._V1_SX300.jpg,N/A,6.2,"3,164",tt0109906,movie,N/A,N/A,N/A,N/A,True,6.2/10,65%,,,,,
0,Hoop Dreams,1994,PG-13,14 Oct 1994,170 min,"Documentary, Drama, Sport",Steve James,"Steve James, Frederick Marx","William Gates, Arthur Agee, Emma Gates, Curtis Gates",A film following the lives of two inner-city Chicago boys who struggle to become college basketball players on the road to going professional.,English,USA,Nominated for 1 Oscar. Another 22 wins & 8 nominations.,https://m.media-amazon.com/images/M/MV5BMWMxNDAxN2QtMjQxYS00NzI4LWJlMTctOGJkNTdkNmMyYmJiXkEyXkFqcGdeQXVyNTI4MjkwNjA@._V1_SX300.jpg,98,8.3,"23,350",tt0110057,movie,N/A,N/A,N/A,N/A,True,8.3/10,98%,98/100,,,,
0,Heavenly Creatures,1994,R,14 Oct 1994,99 min,"Biography, Crime, Drama, Thriller",Peter Jackson,"Fran Walsh (screenplay), Peter Jackson (screenplay)","Melanie Lynskey, Kate Winslet, Sarah Peirse, Diana Kent","Two teenage girls share a unique bond; their parents, concerned that the friendship is too intense, separate them, and the girls take revenge.","English, French","New Zealand, Germany",Nominated for 1 Oscar. Another 17 wins & 14 nominations.,https://m.media-amazon.com/images/M/MV5BZjUwNGIwNDctZmQ1ZC00YTEzLWI3MzQtZGMyODlmZGU4ZDdhXkEyXkFqcGdeQXVyMTQxNzMzNDI@._V1_SX300.jpg,N/A,7.3,"57,639",tt0110005,movie,N/A,N/A,N/A,N/A,True,7.3/10,92%,,,,,
0,Houseguest,1995,PG,06 Jan 1995,113 min,Comedy,Randall Miller,"Michael J. Di Gaetano, Lawrence Gay","Sinbad, Phil Hartman, Kim Greist, Kim Murphy","In hot water with the mob over an unpaid debt, a con man poses as a family friend in an affluent Pennsylvania suburb.",English,USA,N/A,https://m.media-amazon.com/images/M/MV5BNGVkZWMwZWItOWQzZS00YTU5LWJjMGUtZTM5MjdmZmQ2YTU3XkEyXkFqcGdeQXVyNzc5MjA3OA@@._V1_SX300.jpg,N/A,6.0,"6,338",tt0110066,movie,N/A,N/A,N/A,N/A,True,6.0/10,14%,,,,,
0,Immortal Beloved,1994,R,27 Jan 1995,121 min,"Biography, Drama, Music, Romance",Bernard Rose,Bernard Rose,"Gary Oldman, Jeroen Krabbé, Isabella Rossellini, Johanna ter Steege","The life and death of the legendary Ludwig van Beethoven. Besides all the work he is known for, the composer once wrote a famous love letter to a nameless beloved, and the movie tries to ...","English, Hungarian","UK, USA",1 nomination.,https://m.media-amazon.com/images/M/MV5BOTgyZTYzZGItYzIzMi00YTBkLTk0ZTktOTg2ZTM3NDcwYjAxXkEyXkFqcGdeQXVyNzc5MjA3OA@@._V1_SX300.jpg,N/A,7.5,"22,321",tt0110116,movie,N/A,N/A,N/A,N/A,True,7.5/10,55%,,,,,
0,Heavyweights,1995,PG,17 Feb 1995,100 min,"Comedy, Drama, Family, Sport",Steven Brill,"Judd Apatow, Steven Brill","David Goldman, Joseph Wayne Miller, Cody Burger, Allen Covert","Plump kids are lured into joining a posh fat camp with the promise of quick weight loss and good times, only to find that the facility is a woodland hellhole run by a psycho ex-fitness instructor.",English,USA,N/A,https://m.media-amazon.com/images/M/MV5BMmUzMmVjZjMtMThkMS00NDRkLWJhYmQtMjcwMmJkY2ExYmQ5XkEyXkFqcGdeQXVyMTQxNzMzNDI@._V1_SX300.jpg,42,6.6,"24,212",tt0110006,movie,N/A,N/A,N/A,N/A,True,6.6/10,29%,42/100,,,,
0,The Hunted,2003,R,14 Mar 2003,94 min,"Action, Crime, Drama, Thriller",William Friedkin,"David Griffiths, Peter Griffiths, Art Monterastelli","Tommy Lee Jones, Benicio Del Toro, Connie Nielsen, Leslie Stefanson",An FBI deep-woods tracker attempts to capture a trained assassin who has made a sport of hunting humans.,"English, Serbo-Croatian",USA,2 nominations.,https://m.media-amazon.com/images/M/MV5BMTI0MjI4ODg2NV5BMl5BanBnXkFtZTcwMzI0NjgyMQ@@._V1_SX300.jpg,40,6.1,"42,641",tt0269347,movie,N/A,N/A,N/A,N/A,True,6.1/10,29%,40/100,,,,
0,I.Q.,1994,PG,25 Dec 1994,100 min,"Comedy, Romance",Fred Schepisi,"Andy Breckman (story), Andy Breckman (screenplay), Michael Leeson (screenplay)","Tim Robbins, Meg Ryan, Walter Matthau, Lou Jacobi","A mechanic romances the mathematician niece of physicist Albert Einstein, with help from Einstein and his friends.","English, German",USA,N/A,https://m.media-amazon.com/images/M/MV5BN2VkMzZlMTctZjVlOS00NmQ1LTg1ZDItMDc5NzhlNDRhMjRiXkEyXkFqcGdeQXVyMTQxNzMzNDI@._V1_SX300.jpg,66,6.2,"23,087",tt0110099,movie,N/A,N/A,N/A,N/A,True,6.2/10,44%,66/100,,,,
0,Interview with the Vampire: The Vampire Chronicles,1994,R,11 Nov 1994,123 min,"Drama, Horror",Neil Jordan,"Anne Rice (screenplay), Anne Rice (novel)","Brad Pitt, Christian Slater, Virginia McCollam, John McConnell","A vampire tells his epic life story: love, betrayal, loneliness, and hunger.","English, French",USA,Nominated for 2 Oscars. Another 24 wins & 34 nominations.,https://m.media-amazon.com/images/M/MV5BYThmYjJhMGItNjlmOC00ZDRiLWEzNjUtZjU4MjA3MzY0MzFmXkEyXkFqcGdeQXVyNTI4MjkwNjA@._V1_SX300.jpg,59,7.6,"285,644",tt0110148,movie,N/A,N/A,N/A,N/A,True,7.6/10,62%,59/100,,,,
0,Jefferson in Paris,1995,PG-13,31 Mar 1995,139 min,"Biography, Drama, History, Romance",James Ivory,Ruth Prawer Jhabvala,"Nick Nolte, Gwyneth Paltrow, Estelle Eonnet, Thandie Newton","One of the obsessive speculations in American history is whether Thomas Jefferson, in the years before he became president, had an affair with (and fathered a child with) his 15-year-old ...","English, French","USA, France",2 nominations.,https://m.media-amazon.com/images/M/MV5BZjQzOTI3ZjgtNjU1OS00YTNjLTg0OGYtNTgwYjAzZWI3OWYzXkEyXkFqcGdeQXVyMTMxMTY0OTQ@._V1_SX300.jpg,45,5.7,"2,720",tt0113463,movie,N/A,N/A,N/A,N/A,True,5.7/10,31%,45/100,,,,
0,The Jerky Boys,1995,R,03 Feb 1995,82 min,"Comedy, Crime",James Melkonian,"James Melkonian, Rich Wilkes, John G. Brennan, Kamal Ahmed","John G. Brennan, Kamal Ahmed, Alan Arkin, William Hickey","When two unemployed telephone pranksters decide to use their vocal ""talents"" to impersonate a Chicago mob boss and curry favor with organized crime in New York, the trouble begins. It isn't...",English,USA,N/A,https://m.media-amazon.com/images/M/MV5BYmVlOTZkNDAtOGMxYy00ZTU4LWIwOTgtZjI2OWIxYTU5OGJiXkEyXkFqcGdeQXVyNzc5MjA3OA@@._V1_SX300.jpg,N/A,4.8,"2,415",tt0110189,movie,12 Sep 1995,N/A,Buena Vista,N/A,True,4.8/10,17%,,,,,
0,Junior,1994,PG-13,23 Nov 1994,109 min,"Comedy, Romance, Sci-Fi",Ivan Reitman,"Kevin Wade, Chris Conrad","Arnold Schwarzenegger, Danny DeVito, Emma Thompson, Frank Langella","As part of a fertility research project, a male scientist agrees to carry a pregnancy in his own body.",English,USA,Nominated for 1 Oscar. Another 4 nominations.,https://m.media-amazon.com/images/M/MV5BMDUwN2E1ODMtMjRiMS00Yzk0LTk1MWYtZjE4M2I5NzcyMmI4XkEyXkFqcGdeQXVyNTIzOTk5ODM@._V1_SX300.jpg,59,4.6,"63,088",tt0110216,movie,N/A,N/A,N/A,N/A,True,4.6/10,36%,59/100,,,,
0,Just Cause,1995,R,17 Feb 1995,102 min,"Action, Crime, Drama, Mystery, Thriller",Arne Glimcher,"John Katzenbach (novel), Jeb Stuart (screenplay), Peter Stone (screenplay)","Sean Connery, Laurence Fishburne, Kate Capshaw, Blair Underwood",A Harvard professor is lured back into the courtroom after twenty-five years to take the case of a young black man condemned to death for the horrific murder of a child.,English,USA,1 win.,https://m.media-amazon.com/images/M/MV5BMzNlNzEyMDEtMjM0Yi00YjNiLWI4YmItNjFjZWQ2MWUxMTZiXkEyXkFqcGdeQXVyNjUwNzk3NDc@._V1_SX300.jpg,N/A,6.4,"23,670",tt0113501,movie,N/A,N/A,N/A,N/A,True,6.4/10,23%,,,,,
0,A Kid in King Arthur's Court,1995,PG,11 Aug 1995,89 min,"Adventure, Comedy, Family, Fantasy, Romance",Michael Gottlieb,"Michael Part, Robert L. Levy","Thomas Ian Nicholas, Joss Ackland, Art Malik, Paloma Baeza",A Little League player is sent back into medieval times where he is given the task of saving Camelot.,English,"USA, Hungary, UK",1 nomination.,https://m.media-amazon.com/images/M/MV5BODc0ZGUyNDYtNTE3MS00YzVhLWFmY2QtZGVlNjFmMjkyNjhlXkEyXkFqcGdeQXVyMjgyOTI1ODY@._V1_SX300.jpg,34,4.7,"5,479",tt0113538,movie,N/A,N/A,N/A,N/A,True,4.7/10,5%,34/100,,,,
0,Kiss of Death,1995,R,21 Apr 1995,101 min,"Action, Crime, Thriller",Barbet Schroeder,"Eleazar Lipsky (story), Ben Hecht, Charles Lederer, Richard Price (screenplay)","David Caruso, Samuel L. Jackson, Nicolas Cage, Helen Hunt",A reformed convict goes undercover with the help of an angry detective to ensnare a psychotic mobster.,English,USA,1 nomination.,https://m.media-amazon.com/images/M/MV5BYTlhZWU3ZjAtNjFkZS00NWQ3LTliOGYtOGZlN2VhOGUxZDRmXkEyXkFqcGdeQXVyNjU0NTI0Nw@@._V1_SX300.jpg,N/A,5.9,"16,375",tt0113552,movie,N/A,N/A,N/A,N/A,True,5.9/10,68%,,,,,
0,Star Wars: Episode IV - A New Hope,1977,PG,25 May 1977,121 min,"Action, Adventure, Fantasy, Sci-Fi",George Lucas,George Lucas,"Mark Hamill, Harrison Ford, Carrie Fisher, Peter Cushing","Luke Skywalker joins forces with a Jedi Knight, a cocky pilot, a Wookiee and two droids to save the galaxy from the Empire's world-destroying battle station, while also attempting to rescue Princess Leia from the mysterious Darth Vader.",English,USA,Won 6 Oscars. Another 52 wins & 28 nominations.,https://m.media-amazon.com/images/M/MV5BNzVlY2MwMjktM2E4OS00Y2Y3LWE3ZjctYzhkZGM3YzA1ZWM2XkEyXkFqcGdeQXVyNzkwMjQ5NzM@._V1_SX300.jpg,90,8.6,"1,188,658",tt0076759,movie,N/A,N/A,N/A,N/A,True,8.6/10,92%,90/100,,,,
0,Little Women,1994,PG,25 Dec 1994,115 min,"Drama, Family, Romance",Gillian Armstrong,"Louisa May Alcott (novel), Robin Swicord (screenplay)","Winona Ryder, Gabriel Byrne, Trini Alvarado, Samantha Mathis",The March sisters live and grow in post-Civil War America.,"English, German, French","USA, Canada",Nominated for 3 Oscars. Another 7 wins & 17 nominations.,https://m.media-amazon.com/images/M/MV5BNmJhNTgzMWYtZTU5OC00MmE2LTlkN2UtNWE0MmJiNWJmNmZjXkEyXkFqcGdeQXVyMTQxNzMzNDI@._V1_SX300.jpg,87,7.3,"49,158",tt0110367,movie,N/A,N/A,N/A,N/A,True,7.3/10,,87/100,,,,
