,Title,Year,Rated,Released,Runtime,Genre,Director,Writer,Actors,Plot,Language,Country,Awards,Poster,Metascore,imdbRating,imdbVotes,imdbID,Type,DVD,BoxOffice,Production,Website,Response,Internet Movie Database,Rotten Tomatoes,Metacritic,totalSeasons,Season,Episode,seriesID
0,Alien,1979,R,22 Jun 1979,117 min,"Horror, Sci-Fi",Ridley Scott,"Dan O'Bannon (screenplay by), Dan O'Bannon (story by), Ronald Shusett (story by)","Tom Skerritt, Sigourney Weaver, Veronica Cartwright, Harry Dean Stanton","After a space merchant vessel receives an unknown transmission as a distress call, one of the crew is attacked by a mysterious life form and they soon realize that its life cycle has merely begun.",English,"UK, USA",Won 1 Oscar. Another 16 wins & 21 nominations.,https://m.media-amazon.com/images/M/MV5BMmQ2MmU3NzktZjAxOC00ZDZhLTk4YzEtMDMyMzcxY2IwMDAyXkEyXkFqcGdeQXVyNzkwMjQ5NzM@._V1_SX300.jpg,89,8.4,"755,624",tt0078748,movie,N/A,N/A,N/A,N/A,True,8.4/10,98%,89/100,,,,
0,Army of Darkness,1992,R,19 Feb 1993,81 min,"Comedy, Horror",Sam Raimi,"Sam Raimi, Ivan Raimi","Bruce Campbell, Embeth Davidtz, Marcus Gilbert, Ian Abercrombie","A man is accidentally transported to 1300 A.D., where he must battle an army of the dead and retrieve the Necronomicon so he can return home.",English,USA,12 wins & 7 nominations.,https://m.media-amazon.com/images/M/MV5BODcyYzM4YTAtNGM5MS00NjU4LTk2Y2ItZjI5NjkzZTk0MmQ1XkEyXkFqcGdeQXVyNjU0OTQ0OTY@._V1_SX300.jpg,57,7.5,"158,476",tt0106308,movie,N/A,N/A,N/A,N/A,True,7.5/10,73%,57/100,,,,
0,The Big Blue,1988,PG,19 Aug 1988,168 min,"Adventure, Drama, Sport",Luc Besson,"Luc Besson (story), Luc Besson (screenplay), Robert Garland (screenplay), Marilyn Goldin (screenplay), Jacques Mayol (screenplay), Marc Perrier (screenplay)","Rosanna Arquette, Jean-Marc Barr, Jean Reno, Paul Shenar","The rivalry between Enzo and Jacques, two childhood friends and now world-renowned free divers, becomes a beautiful and perilous journey into oneself and the unknown.","French, English, Italian",France,3 wins & 6 nominations.,https://m.media-amazon.com/images/M/MV5BOTg5NGE1MjYtZjU3Zi00NWZhLTg4ZmEtMDI0YzMwN2Y2NDIxXkEyXkFqcGdeQXVyNTAyODkwOQ@@._V1_SX300.jpg,35,7.6,"46,375",tt0095250,movie,N/A,N/A,N/A,N/A,True,7.6/10,62%,35/100,,,,
0,Ran,1985,R,01 Jun 1985,162 min,"Action, Drama, War",Akira Kurosawa,"Akira Kurosawa (screenplay), Hideo Oguni (screenplay), Masato Ide (screenplay), William Shakespeare (play)","Tatsuya Nakadai, Akira Terao, Jinpachi Nezu, Daisuke Ryû","In Medieval Japan, an elderly warlord retires, handing over his empire to his three sons. However, he vastly underestimates how the new-found power will corrupt them and cause them to turn on each other...and him.",Japanese,"Japan, France",Won 1 Oscar. Another 29 wins & 22 nominations.,https://m.media-amazon.com/images/M/MV5BZDBjZTM4ZmEtOTA5ZC00NTQzLTkyNzYtMmUxNGU2YjI5YjU5L2ltYWdlXkEyXkFqcGdeQXVyNTAyODkwOQ@@._V1_SX300.jpg,96,8.2,"106,414",tt0089881,movie,N/A,N/A,N/A,N/A,True,8.2/10,97%,96/100,,,,
0,The Killer,1989,R,01 Sep 1990,111 min,"Action, Crime, Drama, Thriller",John Woo,John Woo,"Yun-Fat Chow, Danny Lee, Sally Yeh, Kong Chu","A disillusioned assassin accepts one last hit in hopes of using his earnings to restore vision to a singer he accidentally blinded, only to be double-crossed by his boss.","Cantonese, Mandarin, Japanese",Hong Kong,2 wins & 6 nominations.,https://m.media-amazon.com/images/M/MV5BMDQyMDVhZjItMGI0Mi00MDQ1LTk3NmQtZmRjZGQ5ZTQ2ZDU5XkEyXkFqcGdeQXVyNTAyODkwOQ@@._V1_SX300.jpg,82,7.8,"44,348",tt0097202,movie,N/A,N/A,N/A,N/A,True,7.8/10,98%,82/100,,,,
0,Psycho,1960,R,08 Sep 1960,109 min,"Horror, Mystery, Thriller",Alfred Hitchcock,"Joseph Stefano (screenplay by), Robert Bloch (based on the novel by)","Anthony Perkins, Vera Miles, John Gavin, Janet Leigh","A Phoenix secretary embezzles forty thousand dollars from her employer's client, goes on the run, and checks into a remote motel run by a young man under the domination of his mother.",English,USA,Nominated for 4 Oscars. Another 5 wins & 10 nominations.,https://m.media-amazon.com/images/M/MV5BNTQwNDM1YzItNDAxZC00NWY2LTk0M2UtNDIwNWI5OGUyNWUxXkEyXkFqcGdeQXVyNzkwMjQ5NzM@._V1_SX300.jpg,97,8.5,"577,226",tt0054215,movie,N/A,N/A,N/A,N/A,True,8.5/10,96%,97/100,,,,
0,The Blues Brothers,1980,R,20 Jun 1980,133 min,"Adventure, Comedy, Crime, Music, Musical",John Landis,"Dan Aykroyd, John Landis","Tom Erhart, Gerald Walling, John Belushi, Walter Levine","Jake Blues, just released from prison, puts together his old band to save the Catholic home where he and his brother Elwood were raised.",English,USA,1 win.,https://m.media-amazon.com/images/M/MV5BYTdlMDExOGUtN2I3MS00MjY5LWE1NTAtYzc3MzIxN2M3OWY1XkEyXkFqcGdeQXVyNzkwMjQ5NzM@._V1_SX300.jpg,60,7.9,"175,929",tt0080455,movie,N/A,N/A,N/A,N/A,True,7.9/10,84%,60/100,,,,
0,The Godfather: Part II,1974,R,18 Dec 1974,202 min,"Crime, Drama",Francis Ford Coppola,"Francis Ford Coppola (screenplay by), Mario Puzo (screenplay by), Mario Puzo (based on the novel by)","Al Pacino, Robert Duvall, Diane Keaton, Robert De Niro","The early life and career of Vito Corleone in 1920s New York City is portrayed, while his son, Michael, expands and tightens his grip on the family crime syndicate.","English, Italian, Spanish, Latin, Sicilian",USA,Won 6 Oscars. Another 11 wins & 20 nominations.,https://m.media-amazon.com/images/M/MV5BMWMwMGQzZTItY2JlNC00OWZiLWIyMDctNDk2ZDQ2YjRjMWQ0XkEyXkFqcGdeQXVyNzkwMjQ5NzM@._V1_SX300.jpg,90,9.0,"1,081,282",tt0071562,movie,N/A,N/A,N/A,N/A,True,9.0/10,97%,90/100,,,,
0,Full Metal Jacket,1987,R,10 Jul 1987,116 min,"Drama, War",Stanley Kubrick,"Stanley Kubrick (screenplay by), Michael Herr (screenplay by), Gustav Hasford (screenplay by), Gustav Hasford (based on the novel ""The Short Timers"" by)","Matthew Modine, Adam Baldwin, Vincent D'Onofrio, R. Lee Ermey",A pragmatic U.S. Marine observes the dehumanizing effects the Vietnam War has on his fellow recruits from their brutal boot camp training to the bloody street fighting in Hue.,"English, Vietnamese","UK, USA",Nominated for 1 Oscar. Another 8 wins & 13 nominations.,https://m.media-amazon.com/images/M/MV5BNzkxODk0NjEtYjc4Mi00ZDI0LTgyYjEtYzc1NDkxY2YzYTgyXkEyXkFqcGdeQXVyNzkwMjQ5NzM@._V1_SX300.jpg,76,8.3,"649,544",tt0093058,movie,N/A,N/A,N/A,N/A,True,8.3/10,91%,76/100,,,,
0,A Grand Day Out,1989,Not Rated,18 May 1990,23 min,"Animation, Short, Adventure, Comedy, Family, Sci-Fi",Nick Park,Nick Park,Peter Sallis,"Wallace takes a break from trying to decide on a holiday destination only to find he has no cheese for his crackers. The solution to both problems is a trip to the moon, with dog Gromit, because everybody knows the moon's made of cheese.",English,UK,Nominated for 1 Oscar. Another 3 wins.,https://m.media-amazon.com/images/M/MV5BYWUyNjg5MTktNDk2Yi00YzUwLTkwMjMtZTdlNTcxZTk4OWY0XkEyXkFqcGdeQXVyNTAyODkwOQ@@._V1_SX300.jpg,N/A,7.8,"30,369",tt0104361,movie,N/A,N/A,N/A,N/A,True,7.8/10,100%,,,,,
0,Henry V,1989,PG-13,08 Nov 1989,137 min,"Action, Biography, Drama, History, Romance, War",Kenneth Branagh,"William Shakespeare (by), Kenneth Branagh (adapted for the screen by)","Derek Jacobi, Kenneth Branagh, Simon Shepherd, James Larkin","In the midst of the Hundred Years War, the young King Henry V of England (Sir Kenneth Branagh) embarks on the conquest of France in 1415.","English, French",UK,Won 1 Oscar. Another 10 wins & 13 nominations.,https://m.media-amazon.com/images/M/MV5BODdlYzU0ZGYtNWQ1YS00Nzk4LTllZTItZTEyNjkxMWI5ODk4L2ltYWdlXkEyXkFqcGdeQXVyNjE5MjUyOTM@._V1_SX300.jpg,83,7.5,"27,403",tt0097499,movie,N/A,N/A,N/A,N/A,True,7.5/10,100%,83/100,,,,
0,Amadeus,1984,R,19 Sep 1984,160 min,"Biography, Drama, History, Music",Milos Forman,"Peter Shaffer (original stage play), Peter Shaffer (original screenplay)","F. Murray Abraham, Tom Hulce, Elizabeth Berridge, Roy Dotrice","The life, success and troubles of Wolfgang Amadeus Mozart, as told by Antonio Salieri, the contemporaneous composer who was insanely jealous of Mozart's talent and claimed to have murdered him.","English, Italian, Latin, German","USA, France, Czechoslovakia, Italy",Won 8 Oscars. Another 34 wins & 14 nominations.,https://m.media-amazon.com/images/M/MV5BNWJlNzUzNGMtYTAwMS00ZjI2LWFmNWQtODcxNWUxODA5YmU1XkEyXkFqcGdeQXVyNTIzOTk5ODM@._V1_SX300.jpg,88,8.3,"356,315",tt0086879,movie,N/A,N/A,N/A,N/A,True,8.3/10,93%,88/100,,,,
0,The Quiet Man,1952,Passed,14 Sep 1952,129 min,"Comedy, Drama, Romance",John Ford,"Frank S. Nugent (screenplay), Maurice Walsh (from the story by)","John Wayne, Maureen O'Hara, Barry Fitzgerald, Ward Bond","A retired American boxer returns to the village of his birth in Ireland, where he falls for a spirited redhead whose brother is contemptuous of their union.","English, Irish",USA,Won 2 Oscars. Another 8 wins & 8 nominations.,https://m.media-amazon.com/images/M/MV5BMWM1ZDhlM2MtNDNmMi00MDk4LTg5MjgtODE4ODk1MjYxOTIwXkEyXkFqcGdeQXVyNjc0MzMzNjA@._V1_SX300.jpg,N/A,7.8,"33,475",tt0045061,movie,N/A,N/A,N/A,N/A,True,7.8/10,90%,,,,,
0,Once Upon a Time in America,1984,R,01 Jun 1984,229 min,"Crime, Drama",Sergio Leone,"Harry Grey (novel), Leonardo Benvenuti (screenplay), Piero De Bernardi (screenplay), Enrico Medioli (screenplay), Franco Arcalli (screenplay), Franco Ferrini (screenplay), Sergio Leone (screenplay), Stuart Kaminsky (additional dialogue)","Robert De Niro, James Woods, Elizabeth McGovern, Treat Williams","A former Prohibition-era Jewish gangster returns to the Lower East Side of Manhattan over thirty years later, where he once again must confront the ghosts and regrets of his old life.","English, Italian, French","USA, Italy",Nominated for 2 Golden Globes. Another 11 wins & 8 nominations.,https://m.media-amazon.com/images/M/MV5BMGFkNWI4MTMtNGQ0OC00MWVmLTk3MTktOGYxN2Y2YWVkZWE2XkEyXkFqcGdeQXVyNjU0OTQ0OTY@._V1_SX300.jpg,N/A,8.4,"297,097",tt0087843,movie,N/A,N/A,N/A,N/A,True,8.4/10,86%,,,,,
0,Raging Bull,1980,R,19 Dec 1980,129 min,"Biography, Drama, Sport",Martin Scorsese,"Jake LaMotta (based on the book by), Joseph Carter (with), Peter Savage (with), Paul Schrader (screenplay), Mardik Martin (screenplay)","Robert De Niro, Cathy Moriarty, Joe Pesci, Frank Vincent","The life of boxer Jake LaMotta, whose violence and temper that led him to the top in the ring destroyed his life outside of it.",English,USA,Won 2 Oscars. Another 22 wins & 28 nominations.,https://m.media-amazon.com/images/M/MV5BYjRmODkzNDItMTNhNi00YjJlLTg0ZjAtODlhZTM0YzgzYThlXkEyXkFqcGdeQXVyNzQ1ODk3MTQ@._V1_SX300.jpg,89,8.2,"308,406",tt0081398,movie,N/A,N/A,N/A,N/A,True,8.2/10,94%,89/100,,,,
0,Annie Hall,1977,PG,20 Apr 1977,93 min,"Comedy, Romance",Woody Allen,"Woody Allen, Marshall Brickman","Woody Allen, Diane Keaton, Tony Roberts, Carol Kane",Neurotic New York comedian Alvy Singer falls in love with the ditzy Annie Hall.,"English, German",USA,Won 4 Oscars. Another 26 wins & 8 nominations.,https://m.media-amazon.com/images/M/MV5BZDg1OGQ4YzgtM2Y2NS00NjA3LWFjYTctMDRlMDI3NWE1OTUyXkEyXkFqcGdeQXVyMjUzOTY1NTc@._V1_SX300.jpg,92,8.0,"245,897",tt0075686,movie,N/A,N/A,N/A,N/A,True,8.0/10,98%,92/100,,,,
0,The Right Stuff,1983,PG,17 Feb 1984,193 min,"Adventure, Biography, Drama, History",Philip Kaufman,"Philip Kaufman (written for the screen by), Tom Wolfe (based on the book by)","Sam Shepard, Scott Glenn, Ed Harris, Dennis Quaid","The story of the original Mercury 7 astronauts and their macho, seat-of-the-pants approach to the space program.","English, Russian",USA,Won 4 Oscars. Another 7 wins & 16 nominations.,https://m.media-amazon.com/images/M/MV5BOTUwMDA3MTYtZjhjMi00ODFmLTg5ZTAtYzgwN2NlODgzMmUwXkEyXkFqcGdeQXVyNjc1NTYyMjg@._V1_SX300.jpg,91,7.8,"54,287",tt0086197,movie,N/A,N/A,N/A,N/A,True,7.8/10,96%,91/100,,,,
0,Stalker,1979,Not Rated,17 Apr 1980,162 min,"Drama, Sci-Fi",Andrei Tarkovsky,"Arkadiy Strugatskiy (novel), Boris Strugatskiy (novel), Arkadiy Strugatskiy (screenplay), Boris Strugatskiy (screenplay)","Alisa Freyndlikh, Aleksandr Kaydanovskiy, Anatoliy Solonitsyn, Nikolay Grinko",A guide leads two men through an area known as the Zone to find a room that grants wishes.,Russian,Soviet Union,2 wins & 2 nominations.,https://m.media-amazon.com/images/M/MV5BMDgwODNmMGItMDcwYi00OWZjLTgyZjAtMGYwMmI4N2Q0NmJmXkEyXkFqcGdeQXVyNzY1MTU0Njk@._V1_SX300.jpg,N/A,8.2,"109,151",tt0079944,movie,N/A,N/A,N/A,N/A,True,8.2/10,100%,,,,,
0,Das Boot,1981,R,10 Feb 1982,149 min,"Adventure, Drama, Thriller, War",Wolfgang Petersen,"Wolfgang Petersen (screenplay), Lothar G. Buchheim (novel)","Jürgen Prochnow, Herbert Grönemeyer, Klaus Wennemann, Hubertus Bengsch","The claustrophobic world of a WWII German U-boat; boredom, filth and sheer terror.",German,West Germany,Nominated for 6 Oscars. Another 13 wins & 5 nominations.,https://m.media-amazon.com/images/M/MV5BNGRmOWY0MGUtNTVhMy00NzRlLTljNDAtNTBiNTRlODgxNmY2XkEyXkFqcGdeQXVyNjc1NTYyMjg@._V1_SX300.jpg,86,8.3,"223,285",tt0082096,movie,N/A,N/A,N/A,N/A,True,8.3/10,98%,86/100,,,,
0,The Sting,1973,PG,25 Dec 1973,129 min,"Comedy, Crime, Drama",George Roy Hill,David S. Ward,"Paul Newman, Robert Redford, Robert Shaw, Charles Durning",Two grifters team up to pull off the ultimate con.,English,USA,Won 7 Oscars. Another 11 wins & 6 nominations.,https://m.media-amazon.com/images/M/MV5BNGU3NjQ4YTMtZGJjOS00YTQ3LThmNmItMTI5MDE2ODI3NzY3XkEyXkFqcGdeQXVyMjUzOTY1NTc@._V1_SX300.jpg,83,8.3,"233,069",tt0070735,movie,N/A,N/A,N/A,N/A,True,8.3/10,94%,83/100,,,,
0,Harold and Maude,1971,PG,20 Dec 1971,91 min,"Comedy, Drama, Romance",Hal Ashby,Colin Higgins,"Ruth Gordon, Bud Cort, Vivian Pickles, Cyril Cusack","Young, rich, and obsessed with death, Harold finds himself changed forever when he meets lively septuagenarian Maude at a funeral.",English,USA,Nominated for 2 Golden Globes. Another 2 wins & 1 nomination.,https://m.media-amazon.com/images/M/MV5BY2M5Mzg3NjctZTlkNy00MTU0LWFlYTQtY2E2Y2M4NjNiNzllXkEyXkFqcGdeQXVyMTAwMzUyOTc@._V1_SX300.jpg,62,7.9,"68,352",tt0067185,movie,N/A,N/A,N/A,N/A,True,7.9/10,84%,62/100,,,,
0,Trust the Man,2005,R,01 Sep 2006,103 min,"Comedy, Drama, Romance",Bart Freundlich,Bart Freundlich,"David Duchovny, Julianne Moore, Sascha Gillen, Brianna Gillen","After much drama, cheating, and trial separations, two men fight to save their respective relationships.",English,USA,1 nomination.,https://m.media-amazon.com/images/M/MV5BMTkyMTA1NTMzNF5BMl5BanBnXkFtZTcwODA4MjQzMQ@@._V1_SX300.jpg,43,5.7,"8,319",tt0427968,movie,06 Feb 2007,"$1,466,103",Fox Searchlight Pictures,N/A,True,5.7/10,28%,43/100,,,,
0,The Seventh Seal,1957,Not Rated,13 Oct 1958,96 min,"Drama, Fantasy",Ingmar Bergman,"Ingmar Bergman (play), Ingmar Bergman (screenplay)","Gunnar Björnstrand, Bengt Ekerot, Nils Poppe, Max von Sydow","A man seeks answers about life, death, and the existence of God as he plays chess against the Grim Reaper during the Black Plague.","Swedish, Latin",Sweden,8 wins & 2 nominations.,https://m.media-amazon.com/images/M/MV5BM2I1ZWU4YjMtYzU0My00YmMzLWFmNTAtZDJhZGYwMmI3YWQ5XkEyXkFqcGdeQXVyNjU0OTQ0OTY@._V1_SX300.jpg,N/A,8.2,"155,488",tt0050976,movie,N/A,N/A,N/A,N/A,True,8.2/10,93%,,,,,
0,Local Hero,1983,PG,17 Mar 1983,111 min,"Comedy, Drama",Bill Forsyth,Bill Forsyth,"Burt Lancaster, Peter Riegert, Fulton Mackay, Denis Lawson",An American oil company sends a man to Scotland to buy up an entire village where they want to build a refinery. But things don't go as expected.,"English, Russian, Japanese",UK,Won 1 BAFTA Film Award. Another 3 wins & 6 nominations.,https://m.media-amazon.com/images/M/MV5BODhiMmM3YzQtZjMwNy00YTdkLTkwOTItZDhjYWE1ZTVlNmExXkEyXkFqcGdeQXVyMjI4MjA5MzA@._V1_SX300.jpg,82,7.3,"20,057",tt0085859,movie,N/A,N/A,N/A,N/A,True,7.3/10,100%,82/100,,,,
0,Terminator Salvation,2009,PG-13,21 May 2009,115 min,"Action, Adventure, Sci-Fi",McG,"John Brancato, Michael Ferris","Christian Bale, Sam Worthington, Moon Bloodgood, Helena Bonham Carter","In 2018, a mysterious new weapon in the war against the machines, half-human and half-machine, comes to John Connor on the eve of a resistance attack on Skynet. But whose side is he on, and can he be trusted?","English, Italian","USA, Germany, UK, Italy",2 wins & 13 nominations.,https://m.media-amazon.com/images/M/MV5BODE1MTM1MzA2NF5BMl5BanBnXkFtZTcwODQ5MTA2Mg@@._V1_SX300.jpg,49,6.5,"335,787",tt0438488,movie,N/A,N/A,N/A,N/A,True,6.5/10,33%,49/100,,,,
0,Dead Alive,1992,R,12 Feb 1993,104 min,"Comedy, Horror",Peter Jackson,"Stephen Sinclair (story), Stephen Sinclair (screenplay), Fran Walsh (screenplay), Peter Jackson (screenplay)","Timothy Balme, Diana Peñalver, Elizabeth Moody, Ian Watkin","A young man's mother is bitten by a Sumatran rat-monkey. She gets sick and dies, at which time she comes back to life, killing and eating dogs, nurses, friends, and neighbors.","English, Spanish",New Zealand,14 wins & 7 nominations.,https://m.media-amazon.com/images/M/MV5BZTZlZDgxMDktNGIyOC00OGVmLWFkMmYtNWM3MjBmMDUzNTc4XkEyXkFqcGdeQXVyNzkwMjQ5NzM@._V1_SX300.jpg,54,7.5,"89,458",tt0103873,movie,N/A,N/A,N/A,N/A,True,7.5/10,88%,54/100,,,,
0,Glory,1989,R,16 Feb 1990,122 min,"Biography, Drama, History, War",Edward Zwick,"Kevin Jarre (screenplay), Lincoln Kirstein (book), Peter Burchard (book), Robert Gould Shaw (letters)","Matthew Broderick, Denzel Washington, Cary Elwes, Morgan Freeman","Robert Gould Shaw leads the U.S. Civil War's first all-black volunteer company, fighting prejudices from both his own Union Army, and the Confederates.",English,USA,Won 3 Oscars. Another 11 wins & 18 nominations.,https://m.media-amazon.com/images/M/MV5BODhlNjA5MDEtZDVhNS00ZmM3LTg1YzAtZGRjNjhjNTAzNzVkXkEyXkFqcGdeQXVyNjUwMzI2NzU@._V1_SX300.jpg,78,7.8,"116,821",tt0097441,movie,N/A,N/A,N/A,N/A,True,7.8/10,93%,78/100,,,,
0,Rosencrantz & Guildenstern Are Dead,1990,PG,08 Feb 1991,117 min,"Comedy, Drama",Tom Stoppard,Tom Stoppard,"Gary Oldman, Tim Roth, Richard Dreyfuss, Livio Badurina",Two minor characters from the play 'Hamlet' stumble around unaware of their scripted lives and unable to deviate from them.,English,"UK, USA",3 wins & 2 nominations.,https://m.media-amazon.com/images/M/MV5BNjc0MTU0MDY1OV5BMl5BanBnXkFtZTcwMDI2OTY2NA@@._V1_SX300.jpg,N/A,7.5,"20,311",tt0100519,movie,N/A,N/A,N/A,N/A,True,7.5/10,62%,,,,,
0,Manhattan,1979,R,25 Apr 1979,96 min,"Comedy, Drama, Romance",Woody Allen,"Woody Allen, Marshall Brickman","Woody Allen, Diane Keaton, Michael Murphy, Mariel Hemingway",The life of a divorced television writer dating a teenage girl is further complicated when he falls in love with his best friend's mistress.,English,USA,Nominated for 2 Oscars. Another 15 wins & 22 nominations.,https://m.media-amazon.com/images/M/MV5BMzdmY2I3MmEtOGFiZi00MTg1LWIxY2QtNWUwM2NmNWNlY2U5XkEyXkFqcGdeQXVyNDk3NzU2MTQ@._V1_SX300.jpg,83,7.9,"127,809",tt0079522,movie,N/A,N/A,N/A,N/A,True,7.9/10,95%,83/100,,,,
0,Miller's Crossing,1990,R,05 Oct 1990,115 min,"Crime, Drama, Thriller","Joel Coen, Ethan Coen","Joel Coen, Ethan Coen","Gabriel Byrne, Marcia Gay Harden, John Turturro, Jon Polito","Tom Reagan, an advisor to a Prohibition-era crime boss, tries to keep the peace between warring mobs but gets caught in divided loyalties.","English, Italian, Irish, Yiddish",USA,4 wins & 16 nominations.,https://m.media-amazon.com/images/M/MV5BMTY2Njk3MTAzM15BMl5BanBnXkFtZTgwMTY5Mzk4NjE@._V1_SX300.jpg,66,7.8,"122,068",tt0100150,movie,N/A,N/A,N/A,N/A,True,7.8/10,91%,66/100,,,,
0,Dead Poets Society,1989,PG,09 Jun 1989,128 min,"Comedy, Drama",Peter Weir,Tom Schulman,"Robin Williams, Robert Sean Leonard, Ethan Hawke, Josh Charles",English teacher John Keating inspires his students to look at poetry with a different perspective of authentic knowledge and feelings. -Camilo Alarcón,"English, Latin",USA,Won 1 Oscar. Another 19 wins & 18 nominations.,https://m.media-amazon.com/images/M/MV5BOGYwYWNjMzgtNGU4ZC00NWQ2LWEwZjUtMzE1Zjc3NjY3YTU1XkEyXkFqcGdeQXVyMTQxNzMzNDI@._V1_SX300.jpg,79,8.1,"403,999",tt0097165,movie,N/A,N/A,N/A,N/A,True,8.1/10,84%,79/100,,,,
0,The Graduate,1967,PG,21 Dec 1967,106 min,"Comedy, Drama, Romance",Mike Nichols,"Calder Willingham (screenplay), Buck Henry (screenplay), Charles Webb (based on the novel by)","Anne Bancroft, Dustin Hoffman, Katharine Ross, William Daniels",A disillusioned college graduate finds himself torn between his older lover and her daughter.,English,USA,Won 1 Oscar. Another 20 wins & 20 nominations.,https://m.media-amazon.com/images/M/MV5BMTQ0ODc4MDk4Nl5BMl5BanBnXkFtZTcwMTEzNzgzNA@@._V1_SX300.jpg,83,8.0,"247,819",tt0061722,movie,N/A,N/A,N/A,N/A,True,8.0/10,86%,83/100,,,,
0,Touch of Evil,1958,PG-13,09 May 1958,95 min,"Crime, Drama, Film-Noir, Thriller",Orson Welles,"Orson Welles (screenplay), Whit Masterson (based on the novel ""Badge Of Evil"" by)","Charlton Heston, Janet Leigh, Orson Welles, Joseph Calleia","A stark, perverse story of murder, kidnapping, and police corruption in a Mexican border town.","English, Spanish",USA,7 wins & 1 nomination.,https://m.media-amazon.com/images/M/MV5BOTA1MjA3M2EtMmJjZS00OWViLTkwMTEtM2E5ZDk0NTAyNGJiXkEyXkFqcGdeQXVyNzkwMjQ5NzM@._V1_SX300.jpg,99,8.0,"95,898",tt0052311,movie,N/A,N/A,N/A,N/A,True,8.0/10,96%,99/100,,,,
0,La Femme Nikita,1997–2001,Not Rated,13 Jan 1997,60 min,"Action, Drama, Romance, Thriller",N/A,Joel Surnow,"Peta Wilson, Don Francks, Eugene Robert Glazer, Roy Dupuis",Aclandestine anti-terrorist organization fakes the death of a convicted murderer and trains her in the fighting skills necessary to succeed in her new job.,English,Canada,4 wins & 21 nominations.,https://m.media-amazon.com/images/M/MV5BMTcwMjgwNjE0MV5BMl5BanBnXkFtZTYwNTM3Njk5._V1_SX300.jpg,N/A,7.5,"8,817",tt0118379,series,,,,,True,7.5/10,,,5,,,
0,The Bridge on the River Kwai,1957,PG,14 Dec 1957,161 min,"Adventure, Drama, War",David Lean,"Pierre Boulle (novel), Carl Foreman (screenplay), Michael Wilson (screenplay)","William Holden, Alec Guinness, Jack Hawkins, Sessue Hayakawa","British POWs are forced to build a railway bridge across the river Kwai for their Japanese captors, not knowing that the allied forces are planning to destroy it.","English, Japanese, Thai","UK, USA",Won 7 Oscars. Another 23 wins & 7 nominations.,https://m.media-amazon.com/images/M/MV5BMGVhNjhjODktODgxYS00MDdhLTlkZjktYTkyNzQxMTU0ZDYxXkEyXkFqcGdeQXVyNzkwMjQ5NzM@._V1_SX300.jpg,87,8.1,"195,653",tt0050212,movie,N/A,N/A,N/A,N/A,True,8.1/10,95%,87/100,,,,
0,8½,1963,Not Rated,24 Jun 1963,138 min,Drama,Federico Fellini,"Federico Fellini (story), Ennio Flaiano (story), Federico Fellini (screenplay), Tullio Pinelli (screenplay), Ennio Flaiano (screenplay), Brunello Rondi (screenplay)","Marcello Mastroianni, Claudia Cardinale, Anouk Aimée, Sandra Milo",A harried movie director retreats into his memories and fantasies.,"Italian, French, English, German","Italy, France",Won 2 Oscars. Another 17 wins & 9 nominations.,https://m.media-amazon.com/images/M/MV5BMTQ4MTA0NjEzMF5BMl5BanBnXkFtZTgwMDg4NDYxMzE@._V1_SX300.jpg,N/A,8.0,"104,407",tt0056801,movie,N/A,N/A,N/A,N/A,True,8.0/10,98%,,,,,
0,Chinatown,1974,R,20 Jun 1974,130 min,"Drama, Mystery, Thriller",Roman Polanski,Robert Towne,"Jack Nicholson, Faye Dunaway, John Huston, Perry Lopez","A private detective hired to expose an adulterer finds himself caught up in a web of deceit, corruption, and murder.","English, Cantonese, Spanish",USA,Won 1 Oscar. Another 20 wins & 24 nominations.,https://m.media-amazon.com/images/M/MV5BOGMwYmY5ZmEtMzY1Yi00OWJiLTk1Y2MtMzI2MjBhYmZkNTQ0XkEyXkFqcGdeQXVyNzkwMjQ5NzM@._V1_SX300.jpg,92,8.2,"281,416",tt0071315,movie,N/A,N/A,N/A,N/A,True,8.2/10,99%,92/100,,,,
0,The Day the Earth Stood Still,1951,G,25 Dec 1951,92 min,"Drama, Sci-Fi",Robert Wise,"Edmund H. North (screen play), Harry Bates (based on a story by)","Michael Rennie, Patricia Neal, Hugh Marlowe, Sam Jaffe",An alien lands and tells the people of Earth that they must live peacefully or be destroyed as a danger to other planets.,"English, French, Hindi, Russian",USA,Won 1 Golden Globe. Another 2 wins & 1 nomination.,https://m.media-amazon.com/images/M/MV5BMTU5NTBmYTAtOTgyYi00NGM0LWE0ODctZjNiYWM5MmIxYzE4XkEyXkFqcGdeQXVyNTAyODkwOQ@@._V1_SX300.jpg,N/A,7.7,"74,719",tt0043456,movie,N/A,N/A,N/A,N/A,True,7.7/10,95%,,,,,
0,The Treasure of the Sierra Madre,1948,Passed,24 Jan 1948,126 min,"Adventure, Drama, Western",John Huston,"John Huston (screenplay), B. Traven (based on the novel by)","Humphrey Bogart, Walter Huston, Tim Holt, Bruce Bennett",Two Americans searching for work in Mexico convince an old prospector to help them mine for gold in the Sierra Madre Mountains.,"English, Spanish","USA, Mexico",Won 3 Oscars. Another 13 wins & 8 nominations.,https://m.media-amazon.com/images/M/MV5BOTJlZWMxYzEtMjlkMS00ODE0LThlM2ItMDI3NGQ2YjhmMzkxXkEyXkFqcGdeQXVyMDI2NDg0NQ@@._V1_SX300.jpg,98,8.2,"109,298",tt0040897,movie,N/A,N/A,N/A,N/A,True,8.2/10,100%,98/100,,,,
0,Bad Taste,1987,Not Rated,21 Jun 1989,91 min,"Comedy, Horror, Sci-Fi",Peter Jackson,"Peter Jackson, Tony Hiles (additional material), Ken Hammon (additional material)","Terry Potter, Pete O'Herne, Craig Smith, Mike Minett",The population of a small town disappears and is replaced by aliens that chase human flesh for their intergalactic fast-food chain.,"English, Maori",New Zealand,1 win & 1 nomination.,https://m.media-amazon.com/images/M/MV5BNmU5YzQyODEtZjY4MC00ZDA2LTk1YTItZmNiN2MyMWU3MGUzXkEyXkFqcGdeQXVyNjMwMjk0MTQ@._V1_SX300.jpg,52,6.6,"42,534",tt0092610,movie,N/A,N/A,N/A,N/A,True,6.6/10,68%,52/100,,,,
0,Duck Soup,1933,Not Rated,17 Nov 1933,69 min,"Comedy, Musical, War",Leo McCarey,"Bert Kalmar (story), Harry Ruby (story), Arthur Sheekman (additional dialogue), Nat Perrin (additional dialogue)","The Marx Brothers, Groucho Marx, Harpo Marx, Chico Marx",Rufus T. Firefly is named president/dictator of bankrupt Freedonia and declares war on neighboring Sylvania over the love of wealthy Mrs. Teasdale.,English,USA,2 wins & 2 nominations.,https://m.media-amazon.com/images/M/MV5BYmYxZGU2NWYtNzQxZS00NmEyLWIzN2YtMDk5MWM0ODc5ZTE4XkEyXkFqcGdeQXVyNTA4NzY1MzY@._V1_SX300.jpg,93,7.8,"54,091",tt0023969,movie,N/A,N/A,N/A,N/A,True,7.8/10,92%,93/100,,,,
