,Title,Year,Rated,Released,Runtime,Genre,Director,Writer,Actors,Plot,Language,Country,Awards,Poster,Metascore,imdbRating,imdbVotes,imdbID,Type,DVD,BoxOffice,Production,Website,Response,Internet Movie Database,Rotten Tomatoes,Metacritic,totalSeasons,Season,Episode,seriesID
0,Mulholland Falls,1996,R,26 Apr 1996,107 min,"Crime, Drama, Mystery, Thriller",Lee Tamahori,"Peter Dexter (story), Floyd Mutrux (story), Peter Dexter (screenplay)","Nick Nolte, Melanie Griffith, Chazz Palminteri, Michael Madsen","In 1950's Los Angeles, a special crime squad of the LAPD investigates the murder of a young woman.",English,USA,1 win & 1 nomination.,https://m.media-amazon.com/images/M/MV5BOTcwMDE3MTQ5OV5BMl5BanBnXkFtZTcwMzA0MDQ1NA@@._V1_SX300.jpg,N/A,6.3,"15,256",tt0117107,movie,N/A,N/A,N/A,N/A,True,6.3/10,30%,,,,,
0,The Truth About Cats & Dogs,1996,PG-13,26 Apr 1996,97 min,"Comedy, Romance",Michael Lehmann,Audrey Wells,"Uma Thurman, Janeane Garofalo, Ben Chaplin, Jamie Foxx",A successful veternarian & radio show host with low self-esteem asks her model friend to impersonate her when a handsome man wants to see her.,English,USA,2 nominations.,https://m.media-amazon.com/images/M/MV5BOWM0MTA4NjItMzM3ZS00NDJmLTg3NWItNGE5ODIyOGJhNzQ0L2ltYWdlL2ltYWdlXkEyXkFqcGdeQXVyMTQxNzMzNDI@._V1_SX300.jpg,64,6.2,"24,486",tt0117979,movie,N/A,N/A,N/A,N/A,True,6.2/10,85%,64/100,,,,
0,Oliver & Company,1988,G,18 Nov 1988,74 min,"Animation, Adventure, Comedy, Family, Musical",George Scribner,"Jim Cox (animation screenplay), Tim Disney (animation screenplay), James Mangold (animation screenplay), Vance Gerry (story), Mike Gabriel (story), Joe Ranft (story), Jim Mitchell (story), Chris Bailey (story), Kirk Wise (story), David Michener (story), Roger Allers (story), Gary Trousdale (story), Kevin Lima (story), Michael Cedeno (story), Peter Young (story), Leon Joosen (story), Charles Dickens (inspired by ""Oliver Twist"" by), Gerrit Graham (additional story material), Sam Graham (additional story material), Chris Hubbell (additional story material), Steve Hulett (additional story material), Danny Mann (additional story material)","Joey Lawrence, Billy Joel, Cheech Marin, Richard Mulligan",A lost and alone kitten joins a gang of dogs engaged in petty larceny in New York City.,English,USA,Nominated for 1 Golden Globe. Another 1 win & 2 nominations.,https://m.media-amazon.com/images/M/MV5BMTI5NTE2OTQtN2YyZi00OTI5LTljMmEtMDZlMTk0MzNmZmY5L2ltYWdlL2ltYWdlXkEyXkFqcGdeQXVyMTQxNzMzNDI@._V1_SX300.jpg,58,6.7,"41,874",tt0095776,movie,N/A,N/A,N/A,N/A,True,6.7/10,51%,58/100,,,,
0,Celtic Pride,1996,PG-13,19 Apr 1996,91 min,"Comedy, Sport",Tom DeCerchio,"Judd Apatow (story), Colin Quinn (story), Judd Apatow (screenplay)","Damon Wayans, Daniel Stern, Dan Aykroyd, Gail O'Grady",Two over-loyal Celtic fans kidnap their opponent's star player in order to guarantee their team the championship.,English,USA,N/A,https://m.media-amazon.com/images/M/MV5BNjg4NThhNjItZmQzZi00ZDVlLWI5YzgtODY0NDk5YTlmNmNlXkEyXkFqcGdeQXVyMTMxMTY0OTQ@._V1_SX300.jpg,N/A,5.3,"9,338",tt0115851,movie,N/A,N/A,N/A,N/A,True,5.3/10,9%,,,,,
0,Flipper,1996,PG,17 May 1996,95 min,"Adventure, Family",Alan Shapiro,"Ricou Browning (story), Jack Cowden (story), Arthur Weiss (earlier screenplay), Alan Shapiro (screenplay)","Elijah Wood, Paul Hogan, Jonathan Banks, Robert Deacon",A teenage boy sent to spend the summer with his eccentric uncle on the Florida coast befriends a remarkable dolphin - and takes on local bad guys who are polluting the water. With Isaac Hayes.,English,USA,5 nominations.,https://m.media-amazon.com/images/M/MV5BZmUzZGFiYTYtY2I3Ny00MGJmLTlmZTItNTNhZTJjZGQyNDdiXkEyXkFqcGdeQXVyNzc5MjA3OA@@._V1_SX300.jpg,43,5.3,"9,876",tt0116322,movie,N/A,N/A,N/A,N/A,True,5.3/10,32%,43/100,,,,
0,The Captive,2000,Not Rated,27 Sep 2000,118 min,"Drama, Music, Romance",Chantal Akerman,"Chantal Akerman (scenario), Eric De Kuyper (scenario), Marcel Proust (inspired by the book ""La prisonnière"")","Stanislas Merhar, Sylvie Testud, Olivia Bonamy, Liliane Rovère","An adaptation of Proust's ""La Prisoniere"" (book five of ""Remembrance of Things Past""). Set in Paris, France, it is a serious tale of a tragic and dysfunctional love.",French,"France, Belgium",3 nominations.,https://m.media-amazon.com/images/M/MV5BMTAzNDQxNDUzMzNeQTJeQWpwZ15BbWU3MDkwODQ0MjE@._V1_SX300.jpg,N/A,5.9,"1,327",tt0216605,movie,27 Jan 2004,N/A,Gémini Films,N/A,True,5.9/10,64%,,,,,
0,Of Love and Shadows,1994,R,10 May 1996,103 min,"Drama, Romance, Thriller, War",Betty Kaplan,"Isabel Allende (book), Donald Freed (screenplay)","Antonio Banderas, Jennifer Connelly, Stefania Sandrelli, Diego Wallraff","Chile 1973 is ruled by the dictator Pinochet. The wealthy don't see the violence, terror, executions etc. including Irene. She's engaged to an officer in the fascist military. She meets Francisco who opens her eyes to truth and love.",English,"USA, Argentina",4 nominations.,https://m.media-amazon.com/images/M/MV5BMTIwOTMxMjk4OV5BMl5BanBnXkFtZTcwMzUzODkyMQ@@._V1_SX300.jpg,N/A,5.1,"1,863",tt0110712,movie,08 Oct 2002,N/A,Miramax,N/A,True,5.1/10,20%,,,,,
0,Dead Man,1995,R,10 May 1996,121 min,"Adventure, Drama, Fantasy, Western",Jim Jarmusch,Jim Jarmusch,"Johnny Depp, Gary Farmer, Crispin Glover, Lance Henriksen","On the run after murdering a man, accountant William Blake encounters a strange Native American man named Nobody who prepares him for his journey into the spiritual world.","English, Cree","USA, Germany, Japan",5 wins & 14 nominations.,https://m.media-amazon.com/images/M/MV5BYTJlZmQ1OTAtODQzZi00NGIzLWI1MmEtZGE4NjFlOWRhODIyXkEyXkFqcGdeQXVyNTc1NTQxODI@._V1_SX300.jpg,62,7.6,"87,471",tt0112817,movie,N/A,N/A,N/A,N/A,True,7.6/10,71%,62/100,,,,
0,The Horseman on the Roof,1995,R,06 Oct 1995,118 min,"Adventure, Drama, Romance, War",Jean-Paul Rappeneau,"Jean Giono (novel), Jean-Paul Rappeneau, Nina Companeez, Jean-Claude Carrière","Juliette Binoche, Olivier Martinez, Pierre Arditi, François Cluzet","In a time of war and disease, a young officer gallantly tries to help a young woman find her husband.","French, Italian",France,4 wins & 8 nominations.,https://m.media-amazon.com/images/M/MV5BYjlmZWJlM2EtM2IyMS00NWY0LTk1N2MtZGU4MmZhZTIyYTJjXkEyXkFqcGdeQXVyMTA0MjU0Ng@@._V1_SX300.jpg,N/A,7.1,"5,388",tt0113362,movie,03 Jun 2003,N/A,Franco London Films,N/A,True,7.1/10,65%,,,,,
0,Maggie's Stiletto Sisters,1975,R,01 May 1975,91 min,"Action, Crime, Drama",Jack Hill,"Jack Hill (story), F.X. Maier (screenplay), F.X. Maier (story), John Prizer (story)","Robbie Lee, Joanne Nail, Monica Gayle, Asher Brauner",The leader of an inner city girl gang is challenged when a new girl moves into the neighbourhood.,English,USA,N/A,https://m.media-amazon.com/images/M/MV5BYmI0NzIzMDItMTkxYy00NzJjLWI0OGUtZGQ4ODI5YzVjNzExL2ltYWdlXkEyXkFqcGdeQXVyNzc5MjA3OA@@._V1_SX300.jpg,N/A,6.6,"3,095",tt0073778,movie,N/A,N/A,N/A,N/A,True,6.6/10,48%,,,,,
0,Mouth to Mouth,1995,R,05 Sep 1997,106 min,"Comedy, Romance",Manuel Gómez Pereira,"Manuel Gómez Pereira (dialogue), Juan Luis Iborra, Joaquín Oristrell, Naomi Wise","Javier Bardem, Aitana Sánchez-Gijón, Josep Maria Flotats, María Barranco",For financial reasons an unemployed aspiring actor works for a phone-sex enterprise. One day he receives a call from the mysterious wife of one of his best clients.,"Spanish, English",Spain,7 wins & 10 nominations.,https://m.media-amazon.com/images/M/MV5BZjgwYjhiOTUtNzQzZS00Zjg1LWIyOWEtM2RmOTBlZTNiY2E2XkEyXkFqcGdeQXVyMTA0MjU0Ng@@._V1_SX300.jpg,N/A,6.7,"1,502",tt0112546,movie,N/A,N/A,N/A,N/A,True,6.7/10,33%,,,,,
0,The Visitors,1993,R,12 Jul 1996,107 min,"Comedy, Fantasy",Jean-Marie Poiré,"Christian Clavier, Jean-Marie Poiré","Christian Clavier, Jean Reno, Valérie Lemercier, Marie-Anne Chazel","A medieval knight and his servant ask a familiar wizard to move them back in time to prevent father-in-law's accidentally killing. Instead, they fly away to the 20th century.","French, German, English",France,1 win & 8 nominations.,https://m.media-amazon.com/images/M/MV5BMjc2ODE2OTYtNTgyMS00ZDY1LWJiZjMtNzAxODcyN2VjZjhkXkEyXkFqcGdeQXVyMTY5MDE5NA@@._V1_SX300.jpg,N/A,7.1,"30,741",tt0108500,movie,N/A,N/A,N/A,N/A,True,7.1/10,31%,,,,,
0,Multiplicity,1996,PG-13,17 Jul 1996,117 min,"Comedy, Romance, Sci-Fi",Harold Ramis,"Chris Miller (short story), Chris Miller (screenplay), Mary Hale (screenplay), Lowell Ganz (screenplay), Babaloo Mandel (screenplay)","Michael Keaton, Andie MacDowell, Zack Duhame, Katie Schlossberg",A man who never has enough time for the things he wants to do is offered the opportunity to have himself duplicated.,English,USA,N/A,https://m.media-amazon.com/images/M/MV5BNTI4Zjc4MDMtZGJjMS00ZjhjLWJkYTItNjZhNGFjOTY4Y2E4XkEyXkFqcGdeQXVyNTIzOTk5ODM@._V1_SX300.jpg,N/A,6.1,"29,091",tt0117108,movie,N/A,N/A,N/A,N/A,True,6.1/10,43%,,,,,
0,Wallace & Gromit: The Best of Aardman Animation,1996,N/A,14 Jun 1996,75 min,"Animation, Comedy, Family",Nick Park,N/A,N/A,A collection of some of the most popular work featuring Wallace and Gromit.,English,UK,N/A,https://m.media-amazon.com/images/M/MV5BMTUyNDMxOTIxOF5BMl5BanBnXkFtZTcwODA1NTcyMQ@@._V1_SX300.jpg,N/A,8.6,"3,828",tt0118114,movie,N/A,N/A,N/A,N/A,True,8.6/10,,,,,,
0,The Haunted World of Edward D. Wood Jr.,1995,NOT RATED,01 May 1996,89 min,"Documentary, Biography",Brett Thompson,Brett Thompson,"Maila Nurmi, Dolores Fuller, Paul Marco, Conrad Brooks","How was it possible that a movie like ""Plan 9 from Outerspace"" could be made? This documentary about Ed Wood Jr.'s masterpiece gives the answer.",English,USA,1 win & 1 nomination.,https://m.media-amazon.com/images/M/MV5BMTMxMDcyNjQ4N15BMl5BanBnXkFtZTcwMTI2NjcyMQ@@._V1_SX300.jpg,N/A,7.3,399,tt0113270,movie,N/A,N/A,N/A,N/A,True,7.3/10,,,,,,
0,The Craft,1996,R,03 May 1996,101 min,"Drama, Fantasy, Horror, Thriller",Andrew Fleming,"Peter Filardi (story), Peter Filardi (screenplay), Andrew Fleming (screenplay)","Robin Tunney, Fairuza Balk, Neve Campbell, Rachel True","A newcomer to a Catholic prep high school falls in with a trio of outcast teenage girls who practice witchcraft, and they all soon conjure up various spells and curses against those who anger them.","English, French",USA,1 win & 7 nominations.,https://m.media-amazon.com/images/M/MV5BZTBkMWE1NGItZTgxMi00ZTE0LWIzZjAtNzQ5ZGZlZTQxN2EwXkEyXkFqcGdeQXVyMTQxNzMzNDI@._V1_SX300.jpg,55,6.4,"73,137",tt0115963,movie,N/A,N/A,N/A,N/A,True,6.4/10,55%,55/100,,,,
0,The Great White Hype,1996,R,03 May 1996,91 min,"Comedy, Sport",Reginald Hudlin,"Tony Hendra (screenplay), Ron Shelton (screenplay)","Samuel L. Jackson, Jeff Goldblum, Peter Berg, Corbin Bernsen","When the champ's promoter, Reverend Sultan, decides something new is needed to boost the marketability of the boxing matches, he searches and finds the only man to ever beat the champ. The ...",English,USA,N/A,https://m.media-amazon.com/images/M/MV5BZmQ0NGE0MGUtZTNjMi00N2EyLThkMDUtZDg0NzIzNmUxNzc5XkEyXkFqcGdeQXVyNzc5MjA3OA@@._V1_SX300.jpg,N/A,5.5,"8,187",tt0116448,movie,N/A,N/A,N/A,N/A,True,5.5/10,45%,,,,,
0,Save the Last Dance,2001,PG-13,12 Jan 2001,112 min,"Drama, Music, Romance",Thomas Carter,"Duane Adler (story), Duane Adler (screenplay), Cheryl Edwards (screenplay)","Julia Stiles, Sean Patrick Thomas, Kerry Washington, Fredro Starr","A white midwestern girl moves to Chicago, where her new boyfriend is a black teen from the South Side with a rough, semi-criminal past.",English,USA,6 wins & 8 nominations.,https://m.media-amazon.com/images/M/MV5BNjkzMjFkNmQtYTQ2Yy00NTRhLWE0ZGYtNjBmYTcyOTgxNGYxL2ltYWdlL2ltYWdlXkEyXkFqcGdeQXVyMTQxNzMzNDI@._V1_SX300.jpg,53,6.2,"55,585",tt0206275,movie,N/A,N/A,N/A,N/A,True,6.2/10,,53/100,,,,
0,War Stories,2003,R,31 Aug 2004,87 min,"Drama, War",Robert Singer,Peter Noah,"Jeff Goldblum, Lake Bell, Louise Lombard, Jeffrey Nordling","A failed pilot for a drama about two war journalists, a cynical and disillusioned man and an idealist woman who must deal with the horrors of war as well as their own opposing viewpoints while reporting from Uzbekistan.",English,USA,N/A,https://m.media-amazon.com/images/M/MV5BMTUxMjg4OTA5MV5BMl5BanBnXkFtZTcwMTIxNTYyMQ@@._V1_SX300.jpg,N/A,5.9,295,tt0315091,movie,17 Aug 2004,N/A,LionsGate Entertainment,N/A,True,5.9/10,,,,,,
0,Cold Comfort Farm,1995,PG,10 May 1996,105 min,"Comedy, Romance",John Schlesinger,"Malcolm Bradbury (screenplay), Stella Gibbons (novel)","Eileen Atkins, Kate Beckinsale, Sheila Burrell, Stephen Fry","A recently orphaned young woman goes to live with eccentric relatives in Sussex, where she sets about improving their gloomy lives.",English,UK,2 wins & 4 nominations.,https://m.media-amazon.com/images/M/MV5BZWI3MTA3NGEtYTg4ZC00MzgwLTliMGQtMjU2MWM5MmVmYThhXkEyXkFqcGdeQXVyNzc5MjA3OA@@._V1_SX300.jpg,82,7.3,"6,329",tt0112701,movie,N/A,N/A,N/A,N/A,True,7.3/10,83%,82/100,,,,
0,"Institute Benjamenta, or This Dream That One Calls Human Life",1995,N/A,23 Aug 1996,105 min,Drama,"Stephen Quay, Timothy Quay","Alan Passes, Stephen Quay, Timothy Quay, Robert Walser (novel)","Mark Rylance, Alice Krige, Gottfried John, Daniel Smith","A young man goes to a school for servants run by a brother and sister. In the dreamlike and surreal world that he enters, how will his presence impact the people there and possibly even the school itself?","Afrikaans, Spanish, English, German","UK, Japan, Germany",4 wins & 3 nominations.,https://m.media-amazon.com/images/M/MV5BMTA4OTYxNjQ0NDNeQTJeQWpwZ15BbWU3MDU0MTMyMzg@._V1_SX300.jpg,N/A,7.1,"1,682",tt0113429,movie,N/A,N/A,N/A,N/A,True,7.1/10,100%,,,,,
0,The Riches,2007–2008,N/A,12 Mar 2007,45 min,"Comedy, Crime, Drama",N/A,Dmitry Lipkin,"Eddie Izzard, Minnie Driver, Shannon Woodward, Noel Fisher",A family of crooks assume the identity of an upper-middle-class suburban clan in the Deep South.,English,USA,Nominated for 1 Golden Globe. Another 1 win & 10 nominations.,https://m.media-amazon.com/images/M/MV5BMTI1NDI1NTM2Nl5BMl5BanBnXkFtZTcwMDAxMTM0MQ@@._V1_SX300.jpg,N/A,7.8,"7,791",tt0496343,series,,,,,True,7.8/10,,,2,,,
0,Heaven's Prisoners,1996,R,17 May 1996,132 min,"Drama, Mystery, Thriller",Phil Joanou,"James Lee Burke (book), Harley Peyton (screenplay), Scott Frank (screenplay)","Alec Baldwin, Kelly Lynch, Mary Stuart Masterson, Eric Roberts","A hardened New Orleans cop, Dave Robicheaux, finally tosses in the badge and settles into life on the bayou with his wife. But a bizarre plane crash draws him back into the fray when his family is viciously threatened.",English,"USA, UK",1 nomination.,https://m.media-amazon.com/images/M/MV5BZGYyZmE1YTItMzhkNS00NzgwLWFmNzQtNjBkMjMwOWU4MGJiXkEyXkFqcGdeQXVyNjMwMjk0MTQ@._V1_SX300.jpg,N/A,5.8,"4,832",tt0116508,movie,N/A,N/A,N/A,N/A,True,5.8/10,16%,,,,,
0,The Rock,1996,R,07 Jun 1996,136 min,"Action, Adventure, Thriller",Michael Bay,"David Weisberg (story), Douglas Cook (story), David Weisberg (screenplay), Douglas Cook (screenplay), Mark Rosner (screenplay)","Sean Connery, Nicolas Cage, Ed Harris, John Spencer","A mild-mannered chemist and an ex-con must lead the counterstrike when a rogue group of military men, led by a renegade general, threaten a nerve gas attack from Alcatraz against San Francisco.",English,USA,Nominated for 1 Oscar. Another 9 wins & 8 nominations.,https://m.media-amazon.com/images/M/MV5BZDJjOTE0N2EtMmRlZS00NzU0LWE0ZWQtM2Q3MWMxNjcwZjBhXkEyXkFqcGdeQXVyNDk3NzU2MTQ@._V1_SX300.jpg,58,7.4,"304,064",tt0117500,movie,N/A,N/A,N/A,N/A,True,7.4/10,66%,58/100,,,,
0,Getting Away with Murder,1996,R,12 Apr 1996,91 min,Comedy,Harvey Miller,Harvey Miller,"Dan Aykroyd, Lily Tomlin, Jack Lemmon, Bonnie Hunt","When the very moralistic college ethics instructor (Aykroyd) finds himself living next door to an accused German death camp commander (Lemmon), he takes it upon himself to rid the world of ...",English,"UK, USA",N/A,https://m.media-amazon.com/images/M/MV5BMTg5ODkwNzI4MV5BMl5BanBnXkFtZTcwMzg1OTUyMQ@@._V1_SX300.jpg,N/A,4.5,"1,116",tt0116405,movie,N/A,N/A,N/A,N/A,True,4.5/10,0%,,,,,
0,Cemetery Man,1994,R,26 Apr 1996,105 min,"Comedy, Horror",Michele Soavi,"Tiziano Sclavi (novel), Gianni Romoli (screenplay)","Rupert Everett, François Hadji-Lazaro, Anna Falchi, Mickey Knox",A cemetery man must kill the dead a second time when they become zombies.,"Italian, English","Italy, France, Germany",9 wins & 11 nominations.,https://m.media-amazon.com/images/M/MV5BMmFlMDBmNzEtM2QxNS00MzUyLTk1YTAtZTQ3ODM5YThlOTFhXkEyXkFqcGdeQXVyMTQxNzMzNDI@._V1_SX300.jpg,N/A,7.2,"19,304",tt0109592,movie,N/A,N/A,N/A,N/A,True,7.2/10,63%,,,,,
0,Twister,1996,PG-13,10 May 1996,113 min,"Action, Adventure, Thriller",Jan de Bont,"Michael Crichton, Anne-Marie Martin","Helen Hunt, Bill Paxton, Cary Elwes, Jami Gertz","Bill and Jo Harding, advanced storm chasers on the brink of divorce, must join together to create an advanced weather alert system by putting themselves in the cross-hairs of extremely violent tornadoes.",English,USA,Nominated for 2 Oscars. Another 11 wins & 15 nominations.,https://m.media-amazon.com/images/M/MV5BODExYTM0MzEtZGY2Yy00N2ExLTkwZjItNGYzYTRmMWZlOGEzXkEyXkFqcGdeQXVyNDk3NzU2MTQ@._V1_SX300.jpg,68,6.4,"169,343",tt0117998,movie,N/A,N/A,N/A,N/A,True,6.4/10,57%,68/100,,,,
0,Barb Wire,1996,R,03 May 1996,98 min,"Action, Sci-Fi",David Hogan,"Chris Warner (characters in comic), Ilene Chaiken (story), Chuck Pfarrer (screenplay), Ilene Chaiken (screenplay)","Amir AboulEla, Adriana Alexander, David Andriole, Vanessa Lee Asher","During the Second American Civil War in 2017, Barb Wire owns a nightclub called the Hammerhead. Things become complicated when her ex-lover Axel Hood, who is married to the fugitive Corrina Devonshire, re-enters her life.","English, French, German",USA,1 win & 7 nominations.,https://m.media-amazon.com/images/M/MV5BYWQ3NTc1YzQtNDJhYS00NDIzLWFmM2EtZjgxNzQwNDQ4YjNmXkEyXkFqcGdeQXVyNjQ2MjQ5NzM@._V1_SX300.jpg,40,3.3,"24,377",tt0115624,movie,08 Dec 1998,N/A,PolyGram Video,N/A,True,3.3/10,28%,40/100,,,,
0,Le garçu,1995,N/A,03 May 1996,102 min,Drama,Maurice Pialat,"Maurice Pialat (scenario and dialogue), Sylvie Pialat (scenario and dialogue)","Gérard Depardieu, Géraldine Pailhas, Antoine Pialat, Dominique Rocheteau","Antoine is four years old. His father Gerard leaves his mother Sophie. Gerard has several mistresses, but never knows how to leave them. Sophie takes a new lover, Jeannot.",French,France,N/A,https://m.media-amazon.com/images/M/MV5BYzBlMWZlMmUtNTE1MC00ZWNmLThmYjgtOWM1MWNjZmVmMzQzXkEyXkFqcGdeQXVyNzg5OTk2OA@@._V1_SX300.jpg,N/A,6.8,405,tt0113145,movie,N/A,N/A,N/A,N/A,True,6.8/10,,,,,,
0,Ghost in the Shell,1995,Not Rated,29 Mar 1996,83 min,"Animation, Action, Crime, Drama, Mystery, Sci-Fi, Thriller",Mamoru Oshii,"Shirow Masamune (based on the manga by), Kazunori Itô (screenplay)","Atsuko Tanaka, Akio Ôtsuka, Kôichi Yamadera, Yutaka Nakano",A cyborg policewoman and her partner hunt a mysterious and powerful hacker called the Puppet Master.,Japanese,"Japan, UK",5 wins & 2 nominations.,https://m.media-amazon.com/images/M/MV5BYWRiYjQyOGItNzQ1Mi00MGI1LWE3NjItNTg1ZDQwNjUwNDM2XkEyXkFqcGdeQXVyNTAyODkwOQ@@._V1_SX300.jpg,76,8.0,"123,643",tt0113568,movie,N/A,N/A,N/A,N/A,True,8.0/10,96%,76/100,,,,
0,Thinner,1996,R,25 Oct 1996,93 min,"Fantasy, Horror",Tom Holland,"Stephen King (novel), Michael McDowell (screenplay), Tom Holland (screenplay)","Robert John Burke, Lucinda Jenney, Bethany Joy Lenz, Time Winters",An obese attorney is cursed by a gypsy to rapidly and uncontrollably lose weight.,English,USA,2 nominations.,https://m.media-amazon.com/images/M/MV5BMDNlZGZlYjctYzM4OS00YTcyLWE1M2QtMDA5Nzk0MTlhNzcxXkEyXkFqcGdeQXVyMTQxNzMzNDI@._V1_SX300.jpg,33,5.8,"26,903",tt0117894,movie,N/A,N/A,N/A,N/A,True,5.8/10,15%,33/100,,,,
0,Spy Hard,1996,PG-13,24 May 1996,81 min,"Action, Comedy",Rick Friedberg,"Jason Friedberg (story), Aaron Seltzer (story), Rick Friedberg (screenplay), Dick Chudnow (screenplay), Jason Friedberg (screenplay), Aaron Seltzer (screenplay)","Leslie Nielsen, Nicollette Sheridan, Charles Durning, Marcia Gay Harden","Dick Steele, Agent WD-40 is assigned by his Director, to stop the evil General Rancor from destroying the world. WD-40 believed Rancor was dead and he teams up with the hot K.G.B. Agent Veronique Ukrinsky to find Rancor and save the world.","English, French, Spanish",USA,N/A,https://m.media-amazon.com/images/M/MV5BOGFmYWFiZDAtZTc1YS00ZTIxLTkwODctODc0MzUzNGIyNzgwL2ltYWdlXkEyXkFqcGdeQXVyMTQxNzMzNDI@._V1_SX300.jpg,25,5.4,"35,112",tt0117723,movie,N/A,N/A,N/A,N/A,True,5.4/10,8%,25/100,,,,
0,Brothers in Trouble,1995,N/A,14 May 1997,102 min,"Comedy, Drama",Udayan Prasad,"Robert Buckler, Abdullah Hussein (novel)","Om Puri, Pavan Malhotra, Angeline Ball, Ace Bhatti","Amir is an illegal Pakistani immigrant smuggled into England in the 1960's to work, to send money to his family and perhaps even bring them over with him. A skilled laborer, he is forced to...",English,UK,1 win & 1 nomination.,https://m.media-amazon.com/images/M/MV5BMTI0MzM2OTU5OF5BMl5BanBnXkFtZTYwNzIxOTI5._V1_SX300.jpg,N/A,6.8,124,tt0112586,movie,10 Mar 1998,N/A,N/A,N/A,True,6.8/10,,,,,,
0,A Close Shave,1995,Not Rated,29 Dec 1995,30 min,"Animation, Short, Comedy, Crime, Family",Nick Park,"Bob Baker, Nick Park","Peter Sallis, Anne Reid",Wallace's whirlwind romance with the owner of the local wool shop puts his head in a spin; Gromit is framed for sheep-rustling in a fiendish criminal plot.,English,UK,Won 1 Oscar. Another 18 wins.,https://m.media-amazon.com/images/M/MV5BNzliZjhkODctMGJjOS00YWQ3LWEzMjgtYmZjNzMwMDYwYWNjXkEyXkFqcGdeQXVyNTAyODkwOQ@@._V1_SX300.jpg,N/A,8.1,"37,613",tt0112691,movie,N/A,N/A,N/A,N/A,True,8.1/10,100%,,,,,
0,Force of Evil,1948,Passed,01 Mar 1949,79 min,"Crime, Drama, Film-Noir",Abraham Polonsky,"Abraham Polonsky (screenplay), Ira Wolfert (screenplay), Ira Wolfert (novel)","John Garfield, Thomas Gomez, Marie Windsor, Howland Chamberlain","An unethical lawyer, with an older brother he wants to help, becomes a partner with a client in the numbers racket.",English,USA,1 win.,https://m.media-amazon.com/images/M/MV5BZTA5MDA4YjQtOWMyMC00N2FkLWEyYjAtN2M2ODBlMzIxYmM2XkEyXkFqcGdeQXVyNjc1NTYyMjg@._V1_SX300.jpg,89,7.3,"5,468",tt0040366,movie,N/A,N/A,N/A,N/A,True,7.3/10,100%,89/100,,,,
0,The Stupids,1996,PG,30 Aug 1996,94 min,"Adventure, Comedy",John Landis,"James Marshall (characters), Harry Allard (characters), Brent Forrester","Tom Arnold, Jessica Lundy, Bug Hall, Alex McKenna","An incredibly dull-witted family unknowingly stumble upon an illegal weapons deal while on the trail of their ""stolen"" garbage.","English, French","UK, USA",3 wins & 5 nominations.,https://m.media-amazon.com/images/M/MV5BNThjNWEwNGEtN2I5My00MTlmLWI2NjQtYTkxMTUwYTI3MDUxXkEyXkFqcGdeQXVyMTQxNzMzNDI@._V1_SX300.jpg,N/A,4.2,"6,316",tt0117768,movie,10 Feb 2004,N/A,New Line Home Entertainment,N/A,True,4.2/10,20%,,,,,
0,The Arrival,1996,PG-13,31 May 1996,115 min,"Sci-Fi, Thriller",David Twohy,David Twohy,"Charlie Sheen, Lindsay Crouse, Richard Schiff, Shane","Zane, an astronomer, discovers intelligent alien life. But the aliens are keeping a deadly secret, and will do anything to stop Zane from learning it.",English,"USA, Mexico",1 win & 1 nomination.,https://m.media-amazon.com/images/M/MV5BMGI3OTg1NzItNDQxMS00MzY1LTkzODUtYjNkMmUzNTE0MWE0XkEyXkFqcGdeQXVyNDAxNjkxNjQ@._V1_SX300.jpg,56,6.3,"30,802",tt0115571,movie,N/A,N/A,N/A,N/A,True,6.3/10,64%,56/100,,,,
0,Dr. Strangelove or: How I Learned to Stop Worrying and Love the Bomb,1964,PG,29 Jan 1964,95 min,Comedy,Stanley Kubrick,"Stanley Kubrick (screenplay), Terry Southern (screenplay), Peter George (screenplay), Peter George (based on the book: ""Red Alert"" by)","Peter Sellers, George C. Scott, Sterling Hayden, Keenan Wynn",An insane general triggers a path to nuclear holocaust that a War Room full of politicians and generals frantically tries to stop.,"English, Russian","UK, USA",Nominated for 4 Oscars. Another 13 wins & 7 nominations.,https://m.media-amazon.com/images/M/MV5BZWI3ZTMxNjctMjdlNS00NmUwLWFiM2YtZDUyY2I3N2MxYTE0XkEyXkFqcGdeQXVyNzkwMjQ5NzM@._V1_SX300.jpg,97,8.4,"436,500",tt0057012,movie,N/A,N/A,N/A,N/A,True,8.4/10,98%,97/100,,,,
0,Careful,1992,Not Rated,03 Mar 1994,100 min,"Comedy, Drama, Romance",Guy Maddin,"Guy Maddin (screenplay), George Toles (screenplay), George Toles (story)","Kyle McCulloch, Gosia Dobrowolska, Sarah Neville, Brent Neale","In the Alpine village of Tolzbad in the 1800s, the townsfolk talk quietly and restrain their movements lest they incur avalanches. This atmosphere lends itself to repressed emotions - shown...",English,Canada,1 win.,https://m.media-amazon.com/images/M/MV5BMTU2Mjk4MTEzN15BMl5BanBnXkFtZTgwNTExNTkwMzE@._V1_SX300.jpg,62,7.0,"1,614",tt0103926,movie,N/A,N/A,N/A,N/A,True,7.0/10,83%,62/100,,,,
0,A Month by the Lake,1995,PG,22 Sep 1995,92 min,"Comedy, Drama, Romance",John Irvin,"H.E. Bates (from: the novella ""A Month by the Lake"" by), Trevor Bentham (screenplay), Josep Llurba (translation and adaptation)","Vanessa Redgrave, Edward Fox, Uma Thurman, Alida Valli","At a Lake Como resort, Miss Bentley, an attractive older guest, meets a handsome, well-to-do bachelor. But when he's more interested in a beautiful young flirt, the mischievous Miss Bentley goes to outrageous lengths to reel in her catch.",English,"UK, USA",N/A,https://m.media-amazon.com/images/M/MV5BYjk3YjVmZGYtMjk3OC00OTg2LWFkNzMtMDFkYjJkOWIzNzkyXkEyXkFqcGdeQXVyMTQ3Njg3MQ@@._V1_SX300.jpg,N/A,6.2,"2,118",tt0113849,movie,N/A,N/A,N/A,N/A,True,6.2/10,71%,,,,,
0,Gold Diggers: The Secret of Bear Mountain,1995,PG,03 Nov 1995,93 min,"Adventure, Drama, Family, Mystery",Kevin James Dobson,Barry Glasser,"Christina Ricci, Anna Chlumsky, Polly Draper, Brian Kerwin","A city girl teams up with a tomboy to solve the mystery of Bear Mountain, Molly Morgan, and the buried treasure as well as learn about true friendships.",English,"Canada, USA",1 win & 1 nomination.,https://m.media-amazon.com/images/M/MV5BOTc1NjA0YzYtYmFhYS00ZThkLWEzNzctODM3OTE2MmM4N2IyXkEyXkFqcGdeQXVyMTQxNzMzNDI@._V1_SX300.jpg,N/A,6.0,"3,949",tt0113188,movie,N/A,N/A,N/A,N/A,True,6.0/10,50%,,,,,
